#SHEET_NAME,忆-第四回
,,,,,,,,,,默认230,,,,一个清冷、疏离的声音，终于从门内传来。,一個清冷、疏離的聲音，終於從門內傳來。,"A cold, distant voice finally came from behind the door.",冷たくよそよそしい声がようやく門の向こうから聞こえてきた。,"Холодный, отчуждённый голос послышался из-за ворот."
,,方知宥,,,,,,,,默认231,,,,[……］,[……］,"""...""",「……」,"""..."""
,,,,,,,,,,默认232,,,,是雁儿姐的声音！但这语气，比晋地逃亡路上、比客栈初见时，都要冰冷许多。,是雁兒姐的聲音！但這語氣，比晉地逃亡路上、比客棧初見時，都要冰冷許多。,It was <ruby=Swan Goose>Sister Yan</ruby>'s voice! But her tone was far icier than during our flight through Jin Territory—colder even than our first meeting at the inn.,雁姉の声だ。しかしその口調は晋で一緒に逃げていた時よりも、さらには宿で出会った時よりも冷ややかなものだった。,"Это голос сестрички Лебёдушки! Но он был куда холоднее, чем во время нашего бегства в Шаньси. Даже холоднее, чем когда мы впервые встретились в трактире."
,,,,,,,,,,默认233,,,,唉。,唉。,Sigh...,ああ。,Эх...
,,,,,,,,,,默认234,,,,雁儿姐定是听信了赵老头的话，知道了我这“大伯继子”的身份，对我恨屋及乌，如今只剩厌恶了吧？,雁兒姐定是聽信了趙老頭的話，知道了我這“大伯繼子”的身份，對我恨屋及烏，如今只剩厭惡了吧？,"<ruby=Swan Goose>Sister Yan</ruby> must have believed Old Man Zhao's words and learned about my identity as the ""uncle's stepson"", now hating me by association until only disgust remained.",きっと雁姉は趙老人の話を真に受け、私が「伯父の養子」になったことを知って伯父だけでなく私のことまで恨んでいるのだろう。きっと今は嫌悪感しかないに違いない。,"Она наверняка поверила тем словам старика Чжао. Ей известно, что я на самом деле дядин наследник - и теперь, ненавидя всё, что связано с семьёй Фан, ко мне, наверно, она тоже чувствует лишь отвращение."
,,,,,,,,,,默认235,,,,然而，能真切地听到她的声音，确认她还活着，这便太好了。,然而，能真切地聽到她的聲音，確認她還活著，這便太好了。,"Yet hearing her voice clearly, confirming she was alive—that alone was enough.",しかし彼女の声を聞き、生きていることを確認できただけでもよしとしよう。,"Тем не менее, я услышал её голос и убедился, что она жива - это уже великолепно."
,,,,,,,,,,默认236,,,,太好了……,太好了……,Enough...,よかった……,Великолепно...
,,方知宥,,,,,,,,默认237,,小方知宥/09_小方知宥_09,,[雁儿姐，你果然在！……我……我就是想来看看你，跟你说说话。］,[雁兒姐，你果然在！……我……我就是想來看看你，跟你說說話。］,"""<ruby=Swan Goose>Sister Yan</ruby>, you're really here!... I... I just wanted to see you and talk to you.""",「雁姉、やっぱりいたんだ！……えっと……会って話がしたくて……」,"""Сестричка Лебёдушка! Ты тут!.. Я... я просто хотел увидаться с тобой, поговорить!"""
,,,,,,,,,,默认238,,,,我努力让声音听起来轻松些，,我努力讓聲音聽起來輕鬆些，,"I tried to keep my voice light,",なんとか気軽に聞こえるよう繕う。,Я пытался говорить непринуждённо.
,,苏连雁,,,,,,,,默认239,,苏连雁/09_苏连雁_02,,[说什么？］,[說什麼？］,"""Say what?""",「何の？」,"""Поговорить о чём?"""
,,,,,,,,,,默认240,,,,她的声音依旧没有温度。,她的聲音依舊沒有溫度。,Her voice stayed cold.,彼女の声はやはりそっけないものだ。,Тон её голоса не прибавил тепла.
,,方知宥,,,,,,,,默认241,,小方知宥/09_小方知宥_10,,[不要寻死。］,[不要尋死。］,"""Don't throw your life away.""",「死なないで」,"""Не надо пытаться себя убить."""
,,苏连雁,,,,,,,,默认242,,,,[……］,[……］,"""...""",「……」,"""..."""
,,苏连雁,,,,,,,,默认243,,苏连雁/09_苏连雁_03,,[你从哪听说的？］,[你從哪聽說的？］,"""Where'd you hear that?""",「誰に聞いたの？」,"""Где ты это услышал?"""
,,方知宥,,,,,,,,默认244,,小方知宥/09_小方知宥_11,,[我方才在园里，听嬷嬷给我大伯讲的。],[我方才在園裡，聽嬤嬤給我大伯講的。],"""I heard the Matron telling Uncle in Fang Garden.""",「方園で、おばさんが伯父さんに話してるのを」,"""Я подслушал, как кормилица разговаривала с дядей в поместье."""
,,,,,,,,,,默认245,,,,我老实回答。,我老實回答。,I answered truthfully.,私はばか正直に答えた。,Честно ответил я.
,,苏连雁,,,,,,,,默认246,,苏连雁/09_苏连雁_04,,[他都收你做养子了，你还管叫他大伯？],[他都收你做養子了，你還管叫他大伯？],"""He adopted you as his son, yet you still call him Uncle?""",「もう養子になったのに、まだ伯父さんなんて呼んでるの？」,"""Он усыновил тебя, а ты всё ещё называешь его дядей?"""
,,方知宥,,,,,,,,默认247,,小方知宥/09_小方知宥_12,,[他想让我认他做爹，我不愿！他不是我爹！],[他想讓我認他做爹，我不願！他不是我爹！],"""He wanted me to call him father, but I refused! He's not my father!""",「あの人は父さんって思わせたいみたいだけど、僕は嫌だ！あんなの父さんじゃない！」,"""Он хотел, чтобы я называл его папой, но я отказался! Он мне не папа!"""
,,,,,,,,,,默认248,,,,我的回答斩钉截铁。,我的回答斬釘截鐵。,My answer was ironclad.,私はそう言い切った。,Твёрдо ответил я.
,,苏连雁,,,,,,,,默认249,,,,[……],[……],"""...""",「……」,"""..."""
,,,,,,,,,,默认250,,,,又是一阵沉默。,又是一陣沉默。,Silence stretched between us again.,またも沈黙。,Между нами повисла тишина.
,,苏连雁,,,,,,,,默认251,,苏连雁/09_苏连雁_05,,[我不会寻短见的。],[我不會尋短見的。],"""I won't kill myself.""",「そんなことはしない」,"""Я не собираюсь убивать себя."""
,,,,,,,,,,默认252,,,,她的声音低了些，却带着一种奇异的笃定。,她的聲音低了些，卻帶著一種奇異的篤定。,"Her voice dropped slightly, yet carried an odd certainty.",彼女は声を落としたが、奇妙な確信があった。,"Сказала она тихо, но с какой-то странной уверенностью."
,,方知宥,,,,,,,,默认253,,小方知宥/09_小方知宥_13,,[那为什么两天没吃饭呀？],[那為什麼兩天沒吃飯呀？],"""Then why haven't you eaten for two days?""",「じゃあどうして二日もご飯を食べてないの？」,"""Так почему ты не ела два дня?"""
,,,,,,,,,,默认254,,,,我追问，担忧稍微消减了几分，但依然想要刨根问底。,我追問，擔憂稍微消減了幾分，但依然想要刨根問底。,"I pressed further, my worry slightly eased but still determined to get to the truth.",私はさらに問う。不安は幾分か和らいだが、追及をやめるつもりはなかった。,"Продолжил я расспрашивать её. Пусть волнение за неё слегка и улеглось, но мне всё равно хотелось узнать правду."
,,苏连雁,,,,,,,,默认255,,苏连雁/09_苏连雁_06,,[我没必要告诉你。],[我沒必要告訴你。],"""I don't owe you an explanation.""",「あんたに話す義理はない」,"""Не твоё дело."""
,,方知宥,,,,,,,,默认256,,,,[……],[……],"""...""",「……」,"""..."""
,,,,,,,,,,默认257,,,,我微微一愣。,我微微一愣。,I froze momentarily.,私は少し呆気にとられた。,Я на мгновение растерялся.
,,,,,,,,,,默认258,,,,此刻，雁儿姐大概对我充满了敌意了吧。,此刻，雁兒姐大概對我充滿了敵意了吧。,"By now, <ruby=Swan Goose>Sister Yan</ruby> must've been seething with hostility toward me.",この時の雁姉は、おそらく私に敵意をむき出しにしていたのだろう。,Сейчас сестричка Лебёдушка наверняка настроена ко мне враждебно.
,,,,,,,,,,默认259,,,,我们都是从晋地来到扬州，境遇却大不相同。,我們都是從晉地來到揚州，境遇卻大不相同。,"We both came to Yangzhou from Jin Territory, yet our fates diverged completely.",私たちはどちらも晋から揚州に来たが、その境遇はかけ離れている。,"Пусть мы оба прибыли из Шаньси в Янчжоу, но ситуация и судьба у нас кардинально различаются."
,,,,,,,,,,默认260,,,,她不相信我。,她不相信我。,She didn't trust me.,私を信じていないのだ。,Она мне не доверяет.
,,,,,,,,,,默认261,,,,嗯……她是为什么要绝食呢？,嗯……她是為什麼要絕食呢？,Hmph... Why was she refusing food?,ふむ……なぜ食事を断ったのだろうか。,Хм... Почему же она всё-таки отказывается от еды?
,,,,,,,,,,默认262,,,,如果不是为了寻短见，难道是想借此寻找机会逃出去？,如果不是為了尋短見，難道是想藉此尋找機會逃出去？,"If not suicide, was she trying to create an escape opportunity?",死ぬつもりがないのであれば、まさか……この隙に逃げ出すつもりだったとか？,"Если она действительно не хочет убивать себя - может, это её попытка создать себе возможность для побега?"
,,方知宥,,,,,,,,默认263,,小方知宥/09_小方知宥_14,,[雁儿姐，我会想办法帮你逃出去的……这锁……我会在方园里多找找，看能不能找到钥匙，帮你打开！],[雁兒姐，我會想辦法幫你逃出去的……這鎖……我會在方園裡多找找，看能不能找到鑰匙，幫你打開！],"""<ruby=Swan Goose>Sister Yan</ruby>, I'll find a way to help you escape... This lock... I'll search Fang Garden thoroughly—maybe I can find the key and free you!""",「雁姉、僕が逃がしてあげるから……この鍵も……方園で鍵を探して、開けてあげるからね！」,"""Сестричка Лебёдушка, я помогу тебе сбежать... Этот замок... Я обыщу поместье, попробую найти ключ и освобожу тебя!"""
,,苏连雁,,,,,,,,默认264,,苏连雁/09_苏连雁_07,,[那老婆子把钥匙挂在脖子上，睡觉都不离身。你拿不到的。],[那老婆子把鑰匙掛在脖子上，睡覺都不離身。你拿不到的。],"""That old hag wears the key around her neck day and night. You'll never get it.""",「鍵はあの婆さんが肌身離さず持ってる。寝る時も手放さない。あんたじゃ無理」,"""Та старая карга постоянно носит ключ на шее, даже ложась спать, не снимает. Тебе его не достать."""
,,方知宥,,,,,,,,默认265,,小方知宥/09_小方知宥_15,,[其他地方没有？］,[其他地方沒有？］,"""Nowhere else?""",「他の場所にはないの？」,"""А ещё ключа нет?"""
,,苏连雁,,,,,,,,默认266,,苏连雁/09_苏连雁_08,,[她亲口说的，只此一把。］,[她親口說的，只此一把。］,"""She swore it’s the only one.""",「鍵はこれだけだって、自分で言ってた」,"""Она сама говорила - есть только этот."""
,,方知宥,,,,,,,,默认267,,,,[……］,[……］,"""...""",「……」,"""..."""
,,,,,,,,,,默认268,,,,如果钥匙真的贴身藏着，硬抢是绝无可能的。,如果鑰匙真的貼身藏著，硬搶是絕無可能的。,"If the key’s truly on her person, force won’t work.",もしそれが事実なら、無理やり奪うことは不可能だ。,"Если единственный ключ только у неё, то грубая сила точно не выход."
,,,,,,,,,,默认269,,,,确实……不好帮雁儿姐逃出来。,確實……不好幫雁兒姐逃出來。,True... No way to help <ruby=Swan Goose>Sister Yan</ruby> escape.,とすると……雁姉を逃がすことは難しそうだ。,Она права... Я не в силах помочь ей сбежать.
,,方知宥,,,,,,,,默认270,,小方知宥/09_小方知宥_16,,[雁儿姐，你整天呆在屋里，都做些什么？］,[雁兒姐，你整天待在屋裡，都做些什麼？］,"""<ruby=Swan Goose>Sister Yan</ruby>, what do you do all day stuck in here?""",「雁姉、屋敷の中でいつも何してるの？」,"""Сестричка Лебёдушка, а чем ты там занимаешься целыми днями?"""
,,,,,,,,,,默认271,,,,也许是试图驱散那沉重的气氛，我换了个话题。,也許是試圖驅散那沉重的氣氛，我換了個話題。,"Maybe to cut through the gloom, I changed the subject.",重苦しい空気を何とかしたくて、私は話題を変えることにした。,"Чтобы разрядить мрачную обстановку, я сменил тему."
,,苏连雁,,,,,,,,默认272,,苏连雁/09_苏连雁_09,,[想我娘，偶尔也会想我爹。],[想我娘，偶爾也會想我爹。],"""I miss my mother, and sometimes my father too.""",「母さんのことを考えたり。時々父さんのことも」,"""По маме скучаю. Иногда и по папе."""
,,,,,,,,,,默认273,,,,她的声音很轻，带着一种遥远的思念。,她的聲音很輕，帶著一種遙遠的思念。,"Her voice was soft, tinged with distant longing.",懐かしさを含んだ、小さな声だった。,Тихим голосом с ноткой отдалённой тоски сказала она.
,,方知宥,,,,,,,,默认274,,小方知宥/09_小方知宥_17,,[每天就只有嬷嬷跟你一起在屋里吗？］,[每天就只有嬤嬤跟你一起在屋裡嗎？］,"""Is it just you and the Matron in the house every day?""",「毎日一緒にいるのはあのおばさんだけ？」,"""Ты каждый день с кормилицей тут сидишь?"""
,,苏连雁,,,,,,,,默认275,,苏连雁/09_苏连雁_10,,[嗯……］,[嗯……］,"""Hmm...""",「うん……」,"""Угу..."""
,,方知宥,,,,,,,,默认276,,小方知宥/09_小方知宥_18,,[你想看书吗？在来扬州的路上，我不知道做些什么的时候，就会去看书……看着看着，一天天就过去了，心里也没那么烦了。］,[你想看書嗎？在來揚州的路上，我不知道做些什麼的時候，就會去看書……看著看著，一天天就過去了，心裡也沒那麼煩了。］,"""Do you want to read? On the way to Yangzhou, whenever I didn’t know what to do, I’d read... The days would pass as I read, and my heart felt lighter.""",「本、読みたい？揚州に来る途中、何をしようか迷った時はいつも本を読んでたんだ……あっという間に一日が過ぎるし、あれこれ悩まなくて済むよ」,"""Почитать хочешь? Во время дороги в Янчжоу мне было скучно, так что я всё время читал... Дни пролетали, и на душе становилось легче."""
,,方知宥,,,,,,,,默认277,,小方知宥/09_小方知宥_19,,[虽然……现在我还想不到开锁的法子，但我可以抄些书上的字句，从这门缝底下塞给你……］,[雖然……現在我還想不到開鎖的法子，但我可以抄些書上的字句，從這門縫底下塞給你……］,"""Though... I still can’t figure out how to unlock this, I can copy passages from books and slide them under the door for you...""",「今は……この鍵を開ける方法がないけど、本に書いてあることを書き写して門の下から差し入れることはできるから……」,"""Я так и не понял как открыть ворота, но я могу переписывать отрывки и просовывать их под воротами."""
,BgEvent,隔门相谈3,,,,,2,,,,,,,,,,,
,,,,,,,,,,默认278,,,,我蹲下身，打量着那狭窄的门缝。,我蹲下身，打量著那狹窄的門縫。,"I crouched, eyeing the narrow gap beneath the door.",私はその場でしゃがみ、狭い門の隙間を見た。,"Я присел, рассматривая узкую щель внизу."
,,苏连雁,,,,,,,,默认279,,苏连雁/09_苏连雁_11,,[我……认得字不多。］,[我……認得字不多。］,"""I... don’t know many characters.""",「あたしは……そんなに字が読めないから」,"""Я... знаю мало иероглифов."""
,,,,,,,,,,默认280,,,,她的声音似乎松动了一丝。,她的聲音似乎鬆動了一絲。,Her voice softened just a fraction.,彼女の声から敵意が少し薄れたような気がする。,Её голос чуть потеплел.
,,方知宥,,,,,,,,默认281,,小方知宥/09_小方知宥_20,,[我可以教你啊。］,[我可以教你啊。］,"""I could teach you.""",「教えてあげる」,"""Я могу научить тебя."""
,,,,,,,,,,默认282,,,,我立刻接口。,我立刻介面。,I jumped in immediately.,すぐに私が答える。,Ответил я незамедлительно.
,,苏连雁,,,,,,,,默认283,,苏连雁/09_苏连雁_12,,[怎么教我？］,[怎麼教我？］,"""How would you teach me?""",「どうやって？」,"""А как ты учить будешь?"""
,,方知宥,,,,,,,,默认284,,小方知宥/09_小方知宥_21,,[每次嬷嬷来方园回话的时候，我就偷偷溜过来，隔着门教你！］,[每次嬤嬤來方園回話的時候，我就偷偷溜過來，隔著門教你！］,"""Whenever the Matron comes to Fang Garden to report, I’ll sneak over and teach you through the door!""",「おばさんが方園まで報告に来た隙に僕が抜け出して、門越しに教えてあげるよ！」,"""Когда кормилица будет уходить в поместье, я буду приходить к тебе и учить тебя через ворота!"""
,,,,,,,,,,默认285,,,,……,……,...,……,...
,,,,,,,,,,默认286,,,,雁儿姐同意了。,雁兒姐同意了。,<ruby=Swan Goose>Sister Yan</ruby> agreed.,雁姉は提案に乗ってくれた。,Сестричка Лебёдушка согласилась.
,,,,,,,,,,默认287,,,,这之后，每当我见到看管雁儿姐的嬷嬷到方园来时，都会偷偷溜到方院，教她一些字句。,這之後，每當我見到看管雁兒姐的嬤嬤到方園來時，都會偷偷溜到方院，教她一些字句。,"After that, whenever I spotted the Matron guarding <ruby=Swan Goose>Sister Yan</ruby> heading to Fang Garden, I’d slip into Fang’s Courtyard to teach her a few words.",その後、雁姉の見張りをしている老婦が方園に来るのを見計らい、私はこっそりと抜け出して彼女に文章を教えてやった。,"После этого, как только я видел, что кормилица пришла в ""сад семьи Фан"", я сразу же пробирался во ""двор семьи Фан"" и учил её грамоте."
,,,,,,,,,,默认288,,,,起初，我会教她认一些单字。,起初，我會教她認一些單字。,"At first, I taught her simple characters.",はじめはいくつかの文字から。,Сначала я учил её простым иероглифам.
,,,,,,,,,,默认289,,,,我会教她怎么写自己的名字，怎么写爹娘的名字，怎么写一些花虫鸟兽的名字。,我會教她怎麼寫自己的名字，怎麼寫爹娘的名字，怎麼寫一些花蟲鳥獸的名字。,"I showed her how to write her own name, then Father's and Mother’s names, even the names of flowers, insects, birds, and beasts.",どうやって自分の名前を書くか、両親の名前はどう書くか、身の回りの動植物などの名前はどう書くかなどを教えた。,"Я показал ей как написать её имя, затем имена её мамы и папы, а так же названия цветов, насекомых, птич и зверей."
,,,,,,,,,,默认290,,,,她问起一些字怎么写、怎么念时，我会在门的对面写出来，再塞在门缝里递给她。,她問起一些字怎麼寫、怎麼念時，我會在門的對面寫出來，再塞在門縫裡遞給她。,"When she asked how to write or pronounce certain characters, I'd write them on my side of the door and slip them through the crack to her.",彼女があの字はどう書くのか、どう読むのかなど訊けば、私は門の向こうで書いて隙間から差し入れた。,"Когда она спрашивала, как пишется или читается тот или иной иероглиф, я писал его снаружи и просовывал под ворота."
,,,,,,,,,,默认291,,,,这个过程中，雁儿姐会给我讲一些她家的事。,這個過程中，雁兒姐會給我講一些她家的事。,"During this time, <ruby=Swan Goose>Sister Yan</ruby> would share stories about her family.",そんなやり取りの中、雁姉が私に家族のことを話してくれるようになった。,В то же время сестричка Лебёдушка рассказывала о своей семье.
,,,,,,,,,,默认292,,,,她出身于一个晋地农户家庭，爹是个老实聪明的农民，娘是家道中落的贵家小姐，曾教她认过一些字。,她出身於一個晉地農戶家庭，爹是個老實聰明的農民，娘是家道中落的貴家小姐，曾教她認過一些字。,"She came from a farming family in Jin Territory—her father was an honest, clever farmer, while her mother, a noblewoman from a fallen household, had taught her some characters.",彼女は晋の農家に生まれた。父は堅実で聡明な農民、母は没落した良家の娘であり、彼女に少しばかり字を教えてくれたようだ。,"Она родилась в крестьянской семье в Шаньси. Папа был умным и честным крестьянином, а мама, будучи дочерью знатного, но разорившегося рода, в своё время немного учила её грамоте."
,,,,,,,,,,默认293,,,,这么看来，我和她虽然出身有一些不同，却都有一个类似的娘。,這麼看來，我和她雖然出身有一些不同，卻都有一個類似的娘。,"In that way, though our backgrounds differed, we both had similar mothers.",そういう意味では私と彼女は家柄こそ違うものの、似たような母を持っていることになる。,"Так что, хоть мы и были из разных миров, наши мамы были похожи."
,,,,,,,,,,默认295,,,,唉……可惜啊。,唉……可惜啊。,Sigh... What a pity.,はぁ……しかし残念だ。,"Эх, как же жаль."
,,,,,,,,,,默认296,,,,她娘还没教她认多少字，更没教她读四书五经，便被恶官兵所杀，早早离世了。,她娘還沒教她認多少字，更沒教她讀四書五經，便被惡官兵所殺，早早離世了。,Before her mother could teach her many characters—let alone the Four Books and Five Classics—she was killed by brutal soldiers and died too soon.,彼女の母は文字も四書五経も雁姉に教えてやる間もなく悪い官兵に殺され、いなくなってしまったのだから。,"Её маму убили злые солдаты, прежде чем та успела научить её даже простым иероглифам, не говоря уж о ""Четверокнижии"" и ""Пятикнижии""."
,,,,,,,,,,默认297,,,,……,……,...,……,...
,,,,,,,,,,默认298,,,,虽说，伯父和那些家仆都称雁儿姐为我的小娘。,雖說，伯父和那些家僕都稱雁兒姐為我的小娘。,Though Uncle and the servants all referred to <ruby=Swan Goose>Sister Yan</ruby> as my stepmother.,伯父や召使たちはみな雁姉のことを私の継母だと言っている。,"Хотя дядя и слуги называют сестричку Лебёдушку моей ""младшей матерью""..."
,,,,,,,,,,默认299,,,,但我不这么认为。,但我不這麼認為。,I never saw her that way.,だが私は認めない。,Я не могу считать её таковой.
,,,,,,,,,,默认300,,,,我不要雁儿姐当我的小娘。,我不要雁兒姐當我的小娘。,I don’t want <ruby=Swan Goose>Sister Yan</ruby> to be my stepmother.,雁姉を継母になどしたくない。,"Я не хочу, чтобы она становилась наложницей моего дяди."
