#SHEET_NAME,忆-第四回
,Command,Arg1,Arg2,Arg3,Arg4,Arg5,Arg6,Arg7,WaitType,Text,PageCtrl,Voice,WindowType,SC,TC,English,Japanese,Russian
,ChapterAnimation,BG_Yi_4,chapter_bg_Y,chapter_title_Y4,Liang,265,,,,,,,,,,,
,*map_yi_4,,,,,,,,,,,,,,,,
,UnlockPlotMap,map_yi_4,,,,,,,,,,,,,,,
,SetChapterName,忆-第四回,,,,,,
,Wait,,,,,,1,
,FadeOut,black,,,,,0,
,Bg,马车窗,,,,,,,,,,,,,,,
,FadeIn,black,,punch,,,1,,,,,,,,,,,
,Ambience,马车颠簸氛围
,AutoSave,,,,,,,,,,,,,,,,,
,,,,,,,,,,默认1,,,,我蜷缩在狭窄的马车车厢里。,我蜷縮在狹窄的馬車車廂裡。,I hunched inside the carriage’s cramped confines.,私は狭い馬車の中で身を縮めていた。,Я сгорбился в тесной повозке.
,,,,,,,,,,默认2,,,,马车的车轮碾过坑洼不平的土路，车厢随着起伏的路面颠簸，每一次颠簸都让我的骨头硌在硬木板上。,馬車的車輪碾過坑窪不平的土路，車廂隨著起伏的路面顛簸，每一次顛簸都讓我的骨頭硌在硬木板上。,"The carriage wheels lurched over the pitted dirt road, the compartment jolting violently with every bump—each impact grinding my bones against the hardwood planks.",車輪がでこぼこの道を軋みながら進んでいく。地面の起伏に合わせて車内が揺れ、そのたびに骨が硬い木にぶつかり痛みが走った。,"Колёса повозки катились по ухабистой грунтовой дороге, каждая кочка заставляла повозку подпрыгивать, отчего мои кости болезненно ударялись о твёрдые деревянные доски."
,,,,,,,,,,默认3,,,,他们说，要送我和雁儿姐去扬州，大伯在那里等着。,他們說，要送我和雁兒姐去揚州，大伯在那裡等著。,"They said <ruby=Swan Goose>Sister Yan</ruby> and I were being sent to Yangzhou, where Eldest Uncle awaited us.",彼ら曰く、私と雁姉は揚州にいる伯父のところに送られるそうだ。,"Мне сказали, что нас с сестричкой Лебёдушкой в Янчжоу уже ждёт мой дядя."
,,,,,,,,,,默认4,,,,这段行程漫长而枯燥。,這段行程漫長而枯燥。,"The journey dragged on, monotonous and exhausting.",長く退屈な道のりだ。,"Дорога, однообразная и изнуряющая, тянулась словно бесконечно."
,,,,,,,,,,默认5,,,,我们先是陆路，要乘颠簸的马车，花二十余日才到京师。,我們先是陸路，要乘顛簸的馬車，花二十餘日才到京師。,"We started by land, rattling in that bone-shaking carriage for over twenty days just to reach the Capital City.",私たちはまず、陸路で揺れる馬車に乗り、二十日あまりで首都へと行く。,"Поначалу мы ехали сухопутным путём, на этой трясущейся повозке - двадцать с лишним дней нам понадобилось, чтобы доехать до столичного города <i>(имеется в виду Нанкин)</i>."
,,,,,,,,,,默认6,,,,接着是水路与陆路交错，我们时而乘船，时而换车，沿着大江再行二十余日。,接著是水路與陸路交錯，我們時而乘船，時而換車，沿著大江再行二十餘日。,Then came the alternating rhythm of waterways and roads—switching between boats and carriages as we traced the great river for another twenty-odd days.,その後は水路と陸路を乗り換える。時には船で、時には馬車で、長江に沿ってさらに二十日あまりを進む。,"Затем в течение ещё двадцати дней мы чередовали транспорт - то на повозках, то на лодках по большим рекам."
,,,,,,,,,,默认7,,,,我们的终点是扬州，那里是方家大伯的府邸。,我們的終點是揚州，那裡是方家大伯的府邸。,"Yangzhou was our final stop, where the Fang Family Manor stood—Uncle's domain.",終点は揚州だ。方家の伯父の屋敷はそこにある。,"Янчжоу был последней остановкой, где нас ждало поместье семьи Фан, где жил дядя."
,,,,,,,,,,默认8,,,,在那里，我将被过继为大伯的儿子。,在那裡，我將被過繼為大伯的兒子。,"There, I would be adopted as Uncle's son.",着いたら、私は伯父の養子に迎えられることになる。,Там он меня усыновит в качестве наследника.
,,,,,,,,,,默认9,,,,而雁儿姐，将成为大伯的小妾。,而雁兒姐，將成為大伯的小妾。,And <ruby=Swan Goose>Sister Yan</ruby> would become Uncle's concubine.,そして雁姉は、伯父の妾に。,А сестричка Лебёдушка станет его наложницей.
,,,,,,,,,,默认10,,,,……,……,...,……,...
,,,,,,,,,,默认11,,,,马车里的窗户很小，只有我的手掌大。,馬車裡的窗戶很小，只有我的手掌大。,"The carriage window was tiny, no larger than my palm.",馬車の窓は小さく、私の手のひらほどしかない。,"Окошко в повозке было крошечным, не больше моей ладони."
,,,,,,,,,,默认12,,,,夜晚的时候，窗外都是一片黑，只有接连不断的蝉鸣声，以及那烦人的蚊虫，嗡嗡地吵人睡觉。,夜晚的時候，窗外都是一片黑，只有接連不斷的蟬鳴聲，以及那煩人的蚊蟲，嗡嗡地吵人睡覺。,"At night, the world outside the window was pitch black, filled only with the ceaseless chirping of cicadas and the maddening buzz of mosquitoes, disturbing my sleep.",夜になると窓の向こうも真っ黒になり、絶え間なく鳴く蝉の声と耳障りな蚊の飛ぶ音が眠りを妨げた。,"Ночью за окном царила кромешная тьма, нарушаемая лишь бесконечным стрёкотом цикад и невыносимым жужжанием комаров, мешавшим заснуть."
,,,,,,,,,,默认13,,,,"""白天的时候，窗外会投射进来一道白光，这白光会照亮飘浮在空气中的尘埃，让它们像是小虫子一样上下飘飞。",白天的時候，窗外會投射進來一道白光，這白光會照亮漂浮在空氣中的塵埃，讓他們像是小蟲子一樣上下飄飛。,"During the day, a beam of white light would pierce through the window, illuminating the dust particles floating in the air, making them dance like tiny insects.",昼になると窓の外から一筋の光が射し込み、車内に漂う砂埃を照らし出した。それらは小虫のようにふよふよとそこらを跳び回る。,"А днём сквозь окошко пробивался луч света, подсвечивая кружившуюся в воздухе пыль, от чего она напоминала летящих то вверх, то вниз маленьких букашек."
,,,,,,,,,,默认14,,,,我经常会趴在马车的小窗前，去看那些沿途的山景。,我經常會趴在馬車的小窗前，去看那些沿途的山景。,I often pressed my face against the carriage's small window to gaze at the mountain scenery passing by.,私はよく馬車の小窓に張り付き、過ぎていく山景を眺めて過ごした。,"Я часто прислонялся лицом к окошку и смотрел на горный пейзаж, тянувшийся вдоль дороги."
,,,,,,,,,,默认15,,,,山峦一片连着一片，层层叠叠地延展向天际。,山巒一片連著一片，層層疊疊地延展向天際。,"Mountains stretch endlessly, range upon range rolling toward the horizon.",山々がずらりと連なり、そのひとつひとつが天へと伸びている。,"Горы бесконечно тянулись цепью хребтов, теряясь за где-то за горизонтом."
,,,,,,,,,,默认16,,,,偶尔，我能看到山间升起一缕笔直的烟尘。,偶爾，我能看到山間升起一縷筆直的煙塵。,"Occasionally, I spot a thin column of dust rising straight between the peaks.",時折、山の合間にまっすぐな煙が昇っているのを見た。,"Иногда я замечал тонкий столб дыма, поднимающийся между вершинами."
,,,,,,,,,,默认17,,,,爹爹曾跟我讲过，如果在山间看到烟尘，便代表着那里有人。,爹爹曾跟我講過，如果在山間看到煙塵，便代表著那裡有人。,Father once told me that smoke in the mountains means people live there.,山間の煙はそこに人が住んでいる証だと父が言っていたな。,"Папа когда-то рассказывал, что дым в горах означает, что там живут люди."
,,,,,,,,,,默认18,,,,如果升起的是青色的烟尘，那里便可能住着神仙。,如果升起的是青色的煙塵，那裡便可能住著神仙。,"If the smoke is blue-tinged, immortals might dwell there.",その煙が青ければ神仙が住んでいるかもしれない。,"А если дым - голубой, то там, возможно, живёт небожитель."
,,,,,,,,,,默认19,,,,我看到的那些烟尘，几乎没有青色的烟尘。,我看到的那些煙塵，幾乎沒有青色的煙塵。,The plumes I see are almost never blue.,私が見た煙に青色はほとんどなかった。,"Дым, который я видел, почти всегда был обычного цвета."
,,,,,,,,,,默认20,,,,但我每看到一处烟尘，都会对着烟尘行礼。,但我每看到一處煙塵，都會對著煙塵行禮。,"Yet whenever I spot one, I bow toward the rising dust.",しかし煙を見るたび、そこに向かって一礼していた。,"Тем не менее, каждый раз, видя дым, я кланялся ему."
,,,,,,,,,,默认21,,,,我想，假如那里万一住着神仙的话，或许便能让我和雁儿姐的爹娘起死回生，我们便不至于过如今的生活。,我想，假如那裡萬一住著神仙的話，或許便能讓我和雁兒姐的爹娘起死回生，我們便不至於過如今的生活。,"I think—if by chance an immortal lives there, perhaps they could bring <ruby=Swan Goose>Sister Yan</ruby>'s and my Father and Mother back from death. Then we wouldn't have to live like this.",仮に万が一神仙が住んでいるのならば、私と雁姉の両親を生き返らせてくれるかもしれない。そうすれば今のように惨めな暮らしもしなくて済むはずだ。そう考えていた。,"Я думал, а что, если там и правда живут небожители? Может, они вернули бы к жизни наших с сестричкой Лебёдушкой родителей. И нам бы не пришлось жить вот так."
,,,,,,,,,,默认22,,,,……,……,...,……,...
,StopAmbience,,,,,,,,,,,,,,,,,
,CharacterOff,,,,,,1,,,,,,,,,,,
,HideMessageWindow,,,,,,,,,,,,,,,,,
,CaptureImage,截图,SpriteCamera,背景截图,,,,,,,,,,,,,,
,Bg,船窗夜,,,,,,,,,,,,,,,,
,RuleFadeOut,截图,FadeCircle,,Linear,,1,,PageWait,,,,,,,,,
,Wait,,,,,,1,,,,,,,,,,,
,ShowMessageWindow,,,,,,,,,,,,,,,,,
,Ambience,荒村,,,,,,,,,,,,,,,,
,,,,,,,,,,默认23,,,,船舱的窗户比马车大多了，足有我半个身子高。,船艙的窗戶比馬車大多了，足有我半個身子高。,"The cabin windows were far larger than those of a carriage, standing nearly half my height.",船の窓は馬車よりもはるかに大きく、私の背丈の半分ほどはあった。,"Окна в каюте были куда больше, чем в повозке, примерно мне по пояс."
,,,,,,,,,,默认24,,,,夜晚，比在山里时要更亮，因为总有一轮圆月映在湖面上。,夜晚，比在山裡時要更亮，因為總有一輪圓月映在湖面上。,"Nights here were brighter than in the mountains, with a full moon perpetually glinting on the lake.",夜は山にいる時よりも明るかった。まん丸な月が湖面に映っていたからだ。,"Ночи с полной луной, мерцающей над озером, были куда светлее, чем в горах."
,Bg,船窗,,,,,1,,,,,,,,,,,
,,,,,,,,,,默认25,,,,白天，风景要更美，轻风吹动湖面，在湖面上吹出一阵阵涟漪，远处依然是山连着山，鲜少能看到村镇。,白天，風景要更美，輕風吹動湖面，在湖面上吹出一陣陣漣漪，遠處依然是山連著山，鮮少能看到村鎮。,"By day, the view grew even lovelier—soft winds ruffled the lake into ripples, while endless mountain ranges loomed in the distance, villages scarcely visible.",昼は一段と美しい景色だった。そよ風が湖面を撫で、さあさあとさざ波が起きた。遠くにはやはり山が並んでおり、村や町はまばらだった。,"Днём вид был ещё красивее - мягкий ветер колыхал поверхность воды, создавая на ней рябь, вдали виднелись горные хребты и едва различимые деревни."
,,,,,,,,,,默认26,,,,偶尔有水鸟从湖面上掠过，它们的足尖点破水面，在湖面上踏起一阵阵更大的涟漪。,偶爾有水鳥從湖面上掠過，它們的足尖點破水面，在湖面上踏起一陣陣更大的漣漪。,"Now and then, waterbirds grazed the lake's surface, their talons pricking the water and sending broader ripples fanning out.",時々水鳥が湖面すれすれをかすめ、足先が水面に触れるとより大きなさざ波が立った。,"Иногда водоплавающие птицы скользили над поверхностью озера, их лапы касались воды, вызывая на ней ещё более заметные круги."
,,,,,,,,,,默认27,,,,涟漪一串串地交汇到一起，在水面开出了一朵朵盛开的花。,漣漪一串串地交匯到一起，在水面開出了一朵朵盛開的花。,"Ripples merged in interlocking chains, blossoming like flowers across the water.",そして、さざ波同士がぶつかると、水面にきれいな花のような模様が浮かび上がるのであった。,"Эти круги сталкивались, образуя узоры, похожие на пышные цветы."
,,,,,,,,,,默认28,,,,……,……,...,……,...
,,,,,,,,,,默认29,,,,我喜欢在船上胜过在马车里。,我喜歡在船上勝過在馬車裡。,I prefer boats to carriages.,私は馬車の中よりも船が好きだった。,"На лодке плыть мне было больше по душе, чем катиться в повозке."
,,,,,,,,,,默认30,,,,我喜欢在河上胜过在山林里。,我喜歡在河上勝過在山林裡。,I prefer rivers to mountain forests.,私は山よりも川が好きだった。,"И реки мне нравились больше, чем горные леса."
,,,,,,,,,,默认31,,,,然而，再美的景致也敌不过时间的消磨。,然而，再美的景致也敵不過時間的消磨。,"Yet no beauty, however breathtaking, can resist time’s decay.",しかしどれほど美しい景色とて、時間の流れにはなす術がない。,"Однако, каким бы прекрасным ни был пейзаж, он не сможет устоять перед течением времени."
,,,,,,,,,,默认32,,,,纵是在船上，日子久了，新鲜的感觉褪尽了，便只剩下了对旅途的厌倦、对未知前路的茫然。,縱是在船上，日子久了，新鮮的感覺褪盡了，便只剩下了對旅途的厭倦、和對未知前路的茫然。,"Even aboard a boat, the novelty wears thin with time, leaving only travel-weariness and dread of the uncertain path ahead.",ずっと船上での日々を過ごしていると新鮮感も薄れていき、残ったものは旅路の退屈さと、これから起きることへの漠然とした不安だけだった。,"Даже на лодке со временем пейзаж приедается, оставляя лишь усталость от дороги и тревогу перед неизвестным."
,,,,,,,,,,默认33,,,,……,……,...,……,...
,StopAmbience,,,,,,1,,,,,,,,,,,
,Bgm,曲终人散,,,,0.2,1,,,,,,,,,,,
,Bg,天空夜,,,,,1,,,,,,,,,,,
,,,,,,,,,,默认34,,,,这一路上，时常有个面生的家仆与我同行。,這一路上，時常有個面生的家僕與我同行。,A stranger—a servant—often accompanied me on this journey.,道中は見知らぬ召使がしばしば私と同行した。,"В пути меня нередко сопровождал слуга, прежде незнакомый мне."
,,,,,,,,,,默认35,,,,他像是大伯府上的人，总是板着一张脸，沉默寡言，大部分时间都在打盹。,他像是大伯府上的人，總是板著一張臉，沉默寡言，大部分時間都在打瞌睡。,"He appeared to be one of Uncle’s men: stern-faced, silent, and prone to dozing.",おそらく伯父の家の者だろう。いつも仏頂面で口数も少なく、ほとんどの時間はうたた寝をしていた。,"Похоже, он был из людей дяди. Всегда с угрюмым выражением лица, молчаливый, большую часть времени он только и делал, что дремал."
,,,,,,,,,,默认36,,,,我试着向他打听大伯家的事，他心情好时会敷衍几句，心情不好便充耳不闻。,我試著向他打聽大伯家的事，他心情好時會敷衍幾句，心情不好便充耳不聞。,"When I probed about Uncle’s household, he’d spare half-answers on good days and ignore me outright on bad ones.",伯父の家について訊いてみると、機嫌の良い時は少しばかり話してくれたが、機嫌の悪い時は無視された。,"Когда я расспрашивал его о доме дяди, если у него было хорошее настроение, он мог небрежно бросить пару фраз, а когда плохое - притворялся, будто не слышит."
,,,,,,,,,,默认37,,,,我也曾小心翼翼地探问雁儿姐的消息。,我也曾小心翼翼地探問雁兒姐的消息。,I too had cautiously inquired about <ruby=Swan Goose>Sister Yan</ruby>'s whereabouts.,雁姉について探りを入れてみた時もあった。,"Я так же осторожно пытался выяснить, где сейчас Лебёдушка."
,,,,,,,,,,默认38,,,,这时，无论他心情如何，都只会沉默以对。,這時，無論他心情如何，都只會沉默以對。,"At this moment, no matter his mood, he would only respond with silence.",すると機嫌の如何を問わず、彼の答えは沈黙のみだった。,"Но на этот вопрос, каким бы ни было у него настроение, он лишь отмалчивался."
,,,,,,,,,,默认39,,,,但我知道，雁儿姐就在我身后。,但我知道，雁兒姐就在我身後。,But I knew—<ruby=Swan Goose>Sister Yan</ruby> was right behind me.,だが私は知っている。雁姉が私の後ろにいることを。,"Хотя я знал, что сестричка Лебёдушка была позади нас."
,,,,,,,,,,默认40,,,,我坐马车时，她在后面那辆更破旧的车里。,我坐馬車時，她在後面那輛更破舊的車裡。,"When I rode the carriage, she was in that shabbier one trailing behind.",私が馬車に乗っていた時、彼女はさらに後ろのおんぼろ馬車の中にいた。,"Когда мы ехали, она была в более убогой повозке позади нас."
,,,,,,,,,,默认41,,,,我乘船时，她就在后面那条载着杂货的船上。,我乘船時，她就在後面那條載著雜貨的船上。,"When I boarded a boat, she was on the cargo vessel following in our wake.",私が船に乗っていた時、彼女は後ろの荷物船の上にいた。,"А когда плыли, она была в грузовой лодке, также позади нас."
,,,,,,,,,,默认42,,,,她和那些运往扬州的货物待在一起，由赵掌柜指派的人严加看管。,她和那些運往揚州的貨物待在一起，由趙掌櫃指派的人嚴加看管。,"She stayed with the goods bound for Yangzhou, tightly guarded under Shopkeeper Zhao's orders.",彼女は揚州へ運ばれる荷物同然に扱われ、趙老人の手の者に厳重に監視されていた。,"Под строгим надзором людей старика Чжао, она всё время была с товаром, отправленным в Янчжоу."
,,,,,,,,,,默认43,,,,我为何会知道呢？,我為何會知道呢？,How did I know?,なぜわかったかというと――,Откуда мне это было известно?
,,,,,,,,,,默认44,,,,因为我总能隐约听到她那里的动静——,因為我總能隱約聽到她那裡的動靜——,Because I could always faintly hear the commotion from her direction———,それは、彼女の立てる物音に私がいつも聞き耳を立てていたからだ。,Потому что мне удавалось расслышать тихие звуки с её стороны:
,,,,,,,,,,默认45,,,,家仆粗鲁的斥骂声、雁儿姐不甘示弱的争吵声、有时……还有她压抑的、断断续续的哭声。,家僕粗魯的斥罵聲、雁兒姐不甘示弱的爭吵聲、有時……還有她壓抑的、斷斷續續的哭聲。,"The servants' rough curses, <ruby=Swan Goose>Sister Yan</ruby>'s defiant retorts, and sometimes... And her suppressed, intermittent sobs.",召使の粗暴な怒声、負けじと言い返す雁姉の声、そして時々……押し殺したような、彼女のすすり泣き。,"Как на неё грубо ругались слуги, как она непримиримо дерзила им в ответ, а иногда... её приглушённый плач."
,,,,,,,,,,默认46,,,,每当那微弱的哭声传来，我的心就像被针扎了一下。,每當那微弱的哭聲傳來，我的心就像被針扎了一下。,"Every time those faint sobs reached me, it felt like needles pricking my heart.",弱々しくしゃくり上げるのが聞こえてくるたび、私の心が針で刺されたように痛んだ。,"Всякий раз, когда я слышал как она плакала, сердце будто пронзали иглы."
,,,,,,,,,,默认47,,,,我认识的雁儿姐，是那样倔强坚韧，甚至比许多男娃子都要刚强。,我認識的雁兒姐，是那樣倔強堅韌，甚至比許多男娃子都要剛強。,"The <ruby=Swan Goose>Sister Yan</ruby> I knew was stubborn and resilient, tougher even than most boys.",私の知っている雁姉は頑としており、そこらの同じ年の少年よりもずっと強かった。,"Сестричка Лебёдушка, которую я знал, была умрямой и стойкой... Круче любого мальчишки."
,,,,,,,,,,默认48,,,,她不会轻易掉泪，能让她哭出声的，若非是挨了打，便是那深埋心底、对亡故亲人的思念。,她不會輕易掉淚，能讓她哭出聲的，若非是挨了打，便是那深埋心底、對亡故親人的思念。,She wouldn't shed tears easily—only beatings or the buried grief for her deceased kin could wrench cries from her.,そうそう涙を流すことなどない。泣き声が漏れるのは殴られた時か、あるいは亡き家族を想っている時くらいだ。,Она бы не стала плакать просто так. Только побои или тоска по умершим родителям могла расстроить её.
,,,,,,,,,,默认49,,,,雁儿姐必定比我更不愿去扬州。,雁兒姐必定比我更不願去揚州。,<ruby=Swan Goose>Sister Yan</ruby> must've resisted going to Yangzhou even more than I did.,私よりも揚州行きを嫌がっていたのは雁姉に違いない。,"Ей, наверное, ещё сильнее меня не хочется ехать в Янчжоу."
,,,,,,,,,,默认50,,,,可惜，他们限制了她所有的自由，她更加逃不掉。,可惜，他們限制了她所有的自由，她更加逃不掉。,A pity they stripped her of all freedom—she stood no chance of escaping.,しかし残念ながら、彼女は自由を奪われ、逃げようにも逃げられない。,"Но, увы, ей не давали вообще никакой свободы, отчего сбежать ей было бы куда труднее."
,,,,,,,,,,默认51,,,,那日我们被赵掌柜捉住后，他们就再没给雁儿姐任何机会。,那日我們被趙掌櫃捉住後，他們就再沒給雁兒姐任何機會。,"After Shopkeeper Zhao caught us that day, they never gave <ruby=Swan Goose>Sister Yan</ruby> another chance.",あの日、趙老人は私たちを捕まえた後、雁姉からあらゆる機会を奪った。,"После того, как нас изловил старик Чжао, ей больше не давали ни единого шанса на побег."
