#SHEET_NAME,番外
,Command,Arg1,Arg2,Arg3,Arg4,Arg5,Arg6,Arg7,WaitType,Text,PageCtrl,Voice,WindowType,SC,TC,English,Japanese,Russian,
,*map_other_1,,,,,,,,,,,,,,,,
,UnlockPlotMap,map_other_1,,,,,,,,,,,,,,,
,SetChapterName,番外,,,,,,
,Bgm,明末_芸芸众生_可循环,,,,0.2,4,,,,,,,,,,,
,Wait,,,,,,1,
,FadeOut,black,,,,,0,
,Bg,天空夜,,,,,,,,,,,,,,,
,FadeIn,black,,,,,1,,,,,,,,,,,
,,,,,,,,,,默认1,,,,银月当空，漫天繁星。,銀月當空，漫天繁星。,"A silver moon dominated the sky, drowning in a sea of stars.",ぽつんと浮かぶ銀色の月、満点に広がる星々。,"Серебряная луна висела на небе, усыпанном звёздами.",
,,,,,,,,,,默认2,,,,船夫轻轻划着桨，洛河在月光下泛着碎银般的粼光。,船夫輕輕划著槳，洛河在月光下泛著碎銀般的粼光。,The boatman's oar dipped quietly as moonlight shattered into liquid silver on the Luo River.,船頭が軽く船を漕ぐ。<ruby=らくが>洛河</ruby>が月明かりの下で銀の粒のようにきらめいていた。,"Лодочник тихонько грёб вёслами, река Лохэ в лунном свете испускала сияние, подобное кусочкам серебра.",
,,,,,,,,,,默认3,,,,河面上吹拂着一阵微风，小船随波起伏，哗哗水声衬得夜色更为宁静。,河面上吹颳著一陣微風，小船隨波起伏，嘩嘩水聲襯得夜色更為寧靜。,"A gentle breeze swept across the river, the small boat rising and falling with the waves as the splashing water deepened the night's tranquility.",水面をそよ風が撫で、小舟が波に乗って上下する。さらさらとした水音が、夜の静けさをいっそう際立たせる。,"Над поверхностью реки пробегал лёгкий ветерок, лодка покачивалась на волнах, а шум воды делал ночную тишину ещё более безмятежной.",
,,,,,,,,,,默认4,,,,船头靠近船舱处，摆放着一盏风灯。,船頭靠近船艙處，擺放著一盞風燈。,"Near the cabin at the bow, a lantern stood watch.",船首の船室近くに、提灯が置かれていた。,На носу лодки возле каюты стоял фонарь с защитой от ветра.,
,,,,,,,,,,默认5,,,,暖黄的光随船身轻轻摇晃，在狭小的船舱里投下了斑驳的影子。,暖黃的光隨船身輕輕搖晃，在狹小的船艙裡投下了斑駁的影子。,"Its warm yellow light swayed with the boat's rhythm, painting mottled shadows across the cramped cabin.",温かな黄色い光が船と共に軽く揺れ、狭い船室にまだらな影を落とした。,"Тёплый жёлтый свет мягко колыхался вместе с корпусом лодки, отбрасывая в тесную каюту пёстрые тени.",
,,,,,,,,,,默认6,,,,我靠坐在舱壁的一侧，满穗坐在对面，我们中间隔着一张茶桌。,我靠坐在艙壁的一側，滿穗坐在對面，我們中間隔著一張茶桌。,"I reclined against the cabin wall while Man Sui sat across from me, a tea table between us.",俺は船室内の端に腰かけ、満穂がその向かいに座る。一台の座卓が俺たちの真ん中に置かれている。,"Я сидел, привалившись к одной из стен каюты, Маньсуй сидела напротив, между нами стоял чайный столик.",
,BgEvent,良穗同船1,,,,,0.5,,,,,,,
,,,,,,,,,,默认7,,,,月光透过窗隙，勾勒出她清瘦的身形。,月光透過窗隙，勾勒出她清瘦的身形。,"Moonlight filtered through the window cracks, tracing the contours of her slender figure.",月明かりが窓を通して入り込み、彼女のほっそりとした輪郭を浮かび上がらせた。,"Лунный свет, пробивавшийся сквозь щель в окне, очерчивал её стройную фигуру.",
,,,,,,,,,,默认8,,,,几缕发丝随风拂动，她的目光沉静地落在我身上，像是藏着许多未说出口的话。此时此刻，我们正在聊这些年发生的事。,幾縷髮絲隨風拂動，她的目光沉靜地落在我身上，像是藏著許多未說出口的話。此時此刻，我們正在聊這些年發生的事。,"Strands of her hair danced in the breeze, her serene gaze lingering on me as though weighted with unspoken words. Here we sat, speaking of the years that had passed.",幾筋かの髪が風になびき、まだ言い残したことが沢山あるとでも言いたげに、彼女の視線が静かに俺に注がれた。今、俺たちはあの時に起きたことについて話しているところだった。,"Несколько прядей её волос подрагивало от ветра, взгляд её был спокойно устремлён на меня, словно тая в себе множество невысказанных слов. В этот момент мы беседовали о том, что с нами происходило за эти годы.",
,,,,,,,,,,默认9,,,,从白日聊到黄昏，再从黄昏聊到晚上，聊了许久。,從白日聊到黃昏，再從黃昏聊到晚上，聊了許久。,"We talked from dawn till dusk, and from dusk deep into the night—our conversation unspooling without end.",昼から夕方まで、夕方から夜まで、俺たちは話し込んだ。,"Так мы проговорили до сумерек, а потом и вовсе до наступления темноты.",
,,良,<Off>,,,,,,,默认10,,良/番外_良_01,,[三年前，也就是崇祯十一年，我们与官军连日苦战，过草地，爬峭壁，最终只剩下数百人，躲到了商洛山中。],[三年前，也就是崇禎十一年，我們與官軍連日苦戰，過草地，爬峭壁，最終只剩下數百人，躲到了商洛山中。],"""Three years ago, in the eleventh year of Chongzhen’s reign, we waged a desperate battle against the government troops for days. After crossing grasslands and scaling cliffs, only a few hundred of us remained, forced to retreat into the Shangluo Mountain.""",「三年前、つまり崇禎十一年のことだ。俺たちと官軍は連日草原を越え、崖を登る苦戦を強いられ、結局残ったのは数百人。ほうほうの体で<ruby=しょうらくざん>商洛山</ruby>まで落ち延びた」,"""Три года назад, то есть на <ruby=1638 г.>одиннадцатом</ruby> году правления Чунчжэня, мы вели ожесточённые бои с правительственными войсками, пересекали степи, карабкались по отвесным скалам, и в конце концов, когда нас осталось всего несколько сотен человек, укрылись в горах Шанло.""",
,,良,<Off>,,,,,,,默认11,,良/番外_良_02,,[官军像梳篦子一样搜山，我们总是饿着肚子东躲西藏，有时倒霉撞上他们，便得在山野间拼命……],[官軍像梳篦子一樣搜山，我們總是餓著肚子東躲西藏，有時倒楣撞上他們，便得在山野間拚命……],"""The government troops scoured the mountains like a fine-toothed comb. We starved, dodging and hiding, and when ill fate crossed our paths, we fled wildly through the wilderness...""",「官軍は櫛ですくかのような山狩りを展開し、俺たちは腹を空かせながら逃げ回った。運悪く連中に見つかれば、やむなく山でまた一戦といった具合にな……」,"""Правительственные войска прочёсывали горы, словно гребень, а нам постоянно приходилось прятаться то тут, то там, да ещё и с пустым брюхом. Временами нам не везло и мы натыкались на них - тогда нам приходилось сражаться не на жизнь, а на смерть в этих глухих горных местах...""",
,,良,<Off>,,,,,,,默认12,,良/番外_良_03,,[有好几次，我觉得自己快撑不住了……最严重那次，我饿得眼前发黑，腿上还带着箭伤，几乎要昏死过去。],[有好幾次，我覺得自己快撐不住了……最嚴重那次，我餓得眼前發黑，腿上還帶著箭傷，幾乎要昏死過去。],"""Time and again, I felt myself nearing collapse... Worst was when hunger blurred my vision, an arrow wound in my leg, leaving me dangling at death’s edge.""",「何度もそんなことをするうちに、いよいよ持たなくなってきた……一番ひどいときは、飢えで視界はふらふら、足にも矢傷でほぼ意識を失いかけてたな」,"""Немало раз мне казалось, что моя песенка уже спета... Самый тяжёлый случай был, когда у меня от голода всё перед глазами темнело, а ноги все были в ранах от стрел - ещё чуть-чуть, и я был готов упасть замертво.""",
,,良,<Off>,,,,,,,默认13,,良/番外_良_04,,[但每当这种时候，我都会在心里反复念着一件事……也是靠着这件事……我一次次熬了过来，活到了现在。],[但每當這種時候，我都會在心裡反覆唸著一件事……也是靠著這件事……我一次次熬了過來，活到了現在。],"""But in moments like these, I would repeat one thing in my heart over and over... It was by clinging to this thought... that I endured time and again, surviving until now.""",「だがそうなるたびに、心の中であることを思い出し続けた……おかげで俺は窮地を何度も乗り越え、ここまで生きてこれたんだ」,"""Но всякий раз в подобные моменты я повторял про себя одну и ту же вещь... И именно благодаря этому... мне удалось преодолеть все эти невзгоды и дожить до сегодняшнего дня.""",
,BgEvent,良穗同船5,,,,,0.5,,,,,,,
,,满穗,,,,,,,,默认14,,满穗/番外_满穗_001,,[哦？那激励着良爷活下来的是什么？],[哦？那激勵著良爺活下來的是什麼？],"""Oh? What was it that kept Master Liang going all these years?""",「え？じゃあ良様に生きる気力を与えてたのは、何だったの？」,"""О? И что же такое помогало тебе выжить, господин Лян?""",
,,,,,,,,,,默认15,,,,满穗轻轻将一缕散下的发丝别到耳后，声音温和。,滿穗輕輕將一縷散下的髮絲別到耳後，聲音溫和。,"Man Sui gently tucked a loose strand of hair behind her ear, her voice soft.",満穂が垂れた髪をそっと耳の後ろにかけ直し、優しい声でそう訊く。,"Мягким голосом спросила Маньсуй, аккуратно заправляя за ухо выбившуюся прядь волос.",
,,良,<Off>,,,,,,,默认16,,良/番外_良_05,,[那年，我答应过你，要把这条命留给你报仇——我不想失约。],[那年，我答應過你，要把這條命留給你報仇——我不想失約。],"""That year, I promised you I’d keep this life of mine for you to claim your vengeance—I did not wish to break that vow.""",「既にあの時に答えたはずだ。この命はおまえの仇討ちのために使うと――約束を違えるつもりはない」,"""В тот год я дал тебе обещание, что сохраню свою жизнь, чтобы ты могла мне отомстить - мне не хотелось нарушать наш с тобой договор.""",
,,,,,,,,,,默认17,,,,我语气平静，每个字却都带着沉甸甸的分量。,我語氣平靜，每個字卻都帶著沉甸甸的分量。,"My tone was calm, yet each word carried an unshakable weight.",淡々とそう答えるが、一言一言に重みがこもっていた。,"Мой тон был спокойным, но каждое слово было наполнено увесистым смыслом.",
,BgEvent,良穗同船3,,,,,0.5,,,,,,,
,,满穗,,,,,,,,默认18,,,,[……],[……],"""...""",「……」,"""...""",
,,,,,,,,,,默认19,,,,满穗听我说完后，没有立刻开口。,滿穗聽我說了後，沒有立刻開口。,"After hearing my words, Man Sui did not speak at once.",俺の答えを聞いた穂は、すぐには何も言わなかった。,"Услышав мои слова, Маньсуй не стала отвечать сразу.",
,,,,,,,,,,默认20,,,,她只是静静地望向窗外，沉默了片刻，方才开口——,她只是靜靜地望向了窗外，沉默了片刻，方才開口——,"She merely gazed quietly out the window, pausing in silence before finally speaking—",静かに窓の外を眺める彼女。少しして、ようやく沈黙を破った――,"Тихо посмотрев в окно, она какое-то время помолчала, а потом заговорила:",
,,满穗,,,,,,,,默认21,,满穗/番外_满穗_002,,[我也一直记得和良爷的约定……这九年来，从未忘记。],[我也一直記得和良爺的約定……這九年來，從未忘記。],"""I've always remembered my promise to Master Liang... Never forgotten it these nine years.""",「私も良様との約束はずっと覚えてる……この九年、忘れたことはない」,"""Я тоже помню про наш с тобой договор, господин Лян... За эти девять лет я ни секунды не забывала о нём.""",
,BgEvent,良穗同船4,,,,,0.5,,,,,,,
,,满穗,,,,,,,,默认22,,满穗/番外_满穗_003,,[大概也是因为这个约定，这些年来，我再没有像当年那样，动过轻生的念头。],[大概也是因為這個約定，這些年來，我再沒有像當年那樣，動過輕生的念頭。],"""Perhaps because of that promise, I've never again contemplated ending my life as I did in those days.""",「その約束があったからこそ、この数年……あの頃のように死に急ぐことがなくなった」,"""Наверно, то, что за эти годы у меня ни разу не было мыслей о самоубийстве, как тогда - это тоже благодаря нашему договору.""",
,,良,<Off>,,,,,,,默认23,,,,[……],[……],"""...""",「……」,"""...""",
,,,,,,,,,,默认24,,,,我静静听着。,我靜靜聽著。,I listened in silence.,黙って彼女の言うことに耳を傾ける。,Я молча слушал её.,
,,,,,,,,,,默认25,,,,其实，我有些好奇这九年来她具体都去了哪些地方、做了些什么。,其實，我有些好奇這九年來她具體都去了哪些地方、做了些什麼。,"In truth, I was curious about where exactly she had gone and what she had done during those nine years.",この九年、こいつがどこへ行き、何をしていたのか興味があった。,"На самом деле, мне самому было любопытно, где именно она успела побывать и чем занималась все эти девять лет.",
,,满穗,,,,,,,,默认26,,,,[……],[……],"""...""",「……」,"""...""",
,,,,,,,,,,默认27,,,,她仿佛猜到了我的想法，直接开了口——,她彷彿猜到了我的想法，直接開了口——,She seemed to read my thoughts and spoke abruptly—,俺が考えていることがわかったのか、彼女が話し出す――,"Она как будто поняла, о чём я думаю, и приступила к рассказу:",
,BgEvent,良穗同船5,,,,,0.5,,,,,,,
,,满穗,,,,,,,,默认28,,满穗/番外_满穗_004,,[最初我们分开了后，我在洛阳做过一年帮厨，后来攒了点小钱，便自己摆摊，挑些太平地方，做些小买卖。],[最初我們分開了後，我在洛陽做過一年幫廚，後來存了點小錢，便自己擺攤，挑些太平地方，做些小買賣。],"""After we first parted, I worked as a kitchen hand in Luoyang for a year. Later, having saved some silver, I set up my own stall, plying my trade in safer regions.""",「別れた後、私は洛陽で一年料理の下働きをした。そこで少しお金を貯めて、平和な場所で自分の屋台を出して商売を始めた」,"""После того, как мы с тобой расстались, я сначала год в Лояне работала помощницей повара, а потом, скопив немного денег, открыла собственный лоток с товарами, выбирала места поспокойнее и занималась там мелкой торговлей.""",
,,满穗,,,,,,,,默认29,,满穗/番外_满穗_005,,[六年前，大概是我十七岁那年，中原变得不太安定，许多人都不敢行商了，闲置的船只也多了起来。],[六年前，大概是我十七歲那年，中原變得不太安定，許多人都不敢行商了，閒置的船隻也多了起來。],"""Six years ago, when I was about seventeen, the Central Plains grew unstable. Many merchants ceased operations, leaving boats to idle in harbors.""",「六年前……十七歳頃だったかな。中原の情勢が不穏になってくると、多くの人が商売を怖がるようになって、放置される船も増えてきた」,"""Шесть лет назад, когда мне было где-то семнадцать, на Центральной равнине стало неспокойно, многие боялись заниматься торговлей, и много судов простаивало.""",
,,满穗,,,,,,,,默认30,,满穗/番外_满穗_006,,[我趁着船价低的时候收了两艘旧船，又雇了些船工，开始跑水上生意。],[我趁著船價低的時候收了兩艘舊船，又雇了些船工，開始跑水上生意。],"""I seized the opportunity when boat prices were low to purchase two old vessels, hired some boatmen, and began operating a waterborne trade.""",「私は船が安くなった頃合いで中古船を二艘買い、船員も雇って水上で商売を始めることにしたの」,"""Пользуясь тем, что цены на суда стали низкими, я купила две старые лодки, наняла нескольких лодочников и начала заниматься торговлей на воде.""",
,,良,<Off>,,,,,,,默认31,,良/番外_良_06,,[现在划船的这位，是你手下的人？],[現在划船的這位，是你手下的人？],"""Is the one rowing the boat one of your men?""",「今船を漕いでいるのも、おまえの部下なのか？」,"""А тот, который сейчас нашу лодку ведёт - тоже один из твоих подчинённых?""",
,,满穗,,,,,,,,默认32,,满穗/番外_满穗_007,,[不，他不是……他是我手下的人介绍的朋友……我生意不算大，手下的人都在忙着跑商。],[不，他不是……他是我手下的人介紹的朋友……我生意不算大，手下的人都在忙著跑商。],"""No, he isn't... He's a friend recommended by one of my subordinates... My business is modest, and my men are all occupied with trade routes at present.""",「ううん、彼は違う……私の部下が紹介してくれた友人よ……うちの商売は大した規模じゃないから、その時の部下はみんな行商に出払ってた」,"""Нет, он не из них... Он - друг одного из моих подчинённых... Предприятие у меня не очень большое, и все мои подчинённые сейчас в работе.""",
,,良,<Off>,,,,,,,默认33,,良/番外_良_07,,[你这身打扮，倒像富家千金，瞧着可不像生意不大……一看便是做大生意的。],[你這身打扮，倒像富家千金，瞧著可不像生意不大……一看便是做大生意的。],"""Your attire resembles that of a wealthy young lady—hardly fitting for someone with a small business... Clearly, you're engaged in grand ventures.""",「だがその身なり、まるで豪商のようだぞ。とても小規模には見えない……相当でかい商売をやっているように見える」,"""Но наряд-то на тебе сейчас как у богатой госпожи, на вид совсем не похоже, что у тебя небольшое предприятие... Напротив, ты выглядишь как весьма состоятельная купчиха.""",
,,,,,,,,,,默认34,,,,我淡笑着调侃道。,我淡笑著調侃道。,"I remarked with a faint, teasing smile.",笑ってからかうようにそう言った。,С улыбкой поддел я её.,
,BgEvent,良穗同船2,,,,,0.5,,,,,,,
,,满穗,,,,,,,,默认35,,满穗/番外_满穗_008,,[呵……这身是我最好的一件了，只在最重要的场合才穿。],[呵……這身是我最好的一件了，只在最重要的場合才穿。],"""Heh... This is my finest outfit, worn only for the most important occasions.""",「ふふ……この服はいちばんのお気に入り。大事な時にしか着ないの」,"""Хех... Просто это мой самый лучший наряд - я его надеваю лишь для самых важных случаев.""",
,,,,,,,,,,默认36,,,,满穗用指尖轻轻拂过衣袖，唇角微弯。,滿穗用指尖輕輕拂過衣袖，唇角微彎。,"Man Sui ran her fingertips lightly over her sleeve, the corner of her lips lifting slightly.",指で袖をそっとなぞると、穂が僅かに口元をほころばせた。,Маньсуй с лёгкой улыбкой тихонько провела кончиками пальцев по рукаву своей одежды.,
,,,,,,,,,,默认37,,,,最重要的场合……,最重要的場合……,The most solemn occasion...,大事な時……,Для самых важных случаев...,
,,,,,,,,,,默认38,,,,她竟如此看重这次重逢。,她竟如此看重這次重逢。,She cherished this reunion beyond measure.,この再会を、これほど大切にしていてくれてたとはな。,"Она, оказывается, очень серьёзно отнеслась к нашей встрече.",
,,,,,,,,,,默认39,,,,不过，与有着血海深仇、却又定下约定的人相见……本身也确实……非同寻常。,不過，與有著血海深仇、卻又定下約定的人相見……本身也確實……非比尋常。,Yet to meet one bound by both blood feud and sacred vow... was truly... extraordinary.,それにしても……肉親の仇でありながら、約束を交わした者と再会か……確かに……普通のことではないな。,"С другой, встреча с человеком, с которым у тебя непримиримая кровная вражда, но с которым ты при этом заключил договор... сама по себе действительно... нечто особенное.",
,,良,<Off>,,,,,,,默认40,,良/番外_良_08,,[咳……你、还带了别的衣服？],[咳……你、還帶了別的衣服？],"""Ahem... Did you bring spare garments?""",「こほん……ところで、他の服は持ってきてるのか？」,"""Кхм... А другую одежду ты с собой брала?""",
,,,,,,,,,,默认41,,,,我听了她的话后略微有些尴尬，于是便生硬地一转话题。,我聽了她的話後略微有些尷尬，於是便生硬地一轉話題。,"Her words left me flustered, so I clumsily shifted the topic.",彼女の話を聞いて少し気まずい思いになり、少々わざとらしいが話題を変えることにした。,"Испытав от её слов некоторое смущение, я попытался неуклюже сменить тему.",
,BgEvent,良穗同船4,,,,,0.5,,,,,,,
,,满穗,,,,,,,,默认42,,满穗/番外_满穗_009,,[别的衣服？哦，在旁边那个箱子里。],[別的衣服？哦，在旁邊那個箱子裡。],"""Spare clothes? Ah, in that trunk yonder.""",「他の服？ああ、それならそこの箱に」,"""Другую одежду? А, ну да, она в том сундуке.""",
,,,,,,,,,,默认43,,,,她侧眼瞟了一眼舱角放着的衣箱，用眼神向我示意。,她側眼瞟了一眼艙角放著的衣箱，用眼神向我示意。,"She cast a sidelong glance toward the clothing chest in the corner, indicating with her gaze.",彼女が船室の角に置いてある箪笥に目をやり、俺に目配せした。,"Кивнула она мне, бросив косой взгляд на сундук для одежды, стоящий в углу каюты.",
,BgEvent,良穗同船5,,,,,0.5,,,,,,,
,,满穗,,,,,,,,默认44,,满穗/番外_满穗_010,,[怎么？良爷现在就想看我换？],[怎麼？良爺現在就想看我換？],"""What? Does Master Liang wish to witness my changing now?""",「どうしたの？私の着替えを見たいの？」,"""А что такое? Хочешь посмотреть, как я переодеваюсь, господин Лян?""",
