#SHEET_NAME,番外
,,,,,,,,,,默认329,,,,我摇头，轻笑了一声。,我搖頭，輕笑了一聲。,I shook my head and let out a light chuckle.,俺は首を振り、軽く笑った。,"Рассмеявшись, покачал я головой.",
,,,,,,,,,,默认330,,,,确实，从几年前开始，我的头上就长了几根白发，如今越长越多，可以说是清晰可见了。,確實，從幾年前開始，我的頭上就長了幾根白髮，如今越長越多，可以說是清晰可見了。,"Indeed, since a few years ago, white hairs had begun to sprout on my head, and now they’ve grown ever more numerous—plain for all to see.",事実、数年前から髪に何本も白髪が混じるようになった。今はますますそれも増え、はっきりとわかる。,"И правда - несколько лет назад у меня на голове появилось несколько седых волос, теперь же их стало ещё больше, и их уже можно ясно разглядеть.",
,,,,,,,,,,默认331,,,,这大概便是变老的开始吧。,這大概便是變老的開始吧。,"This, perhaps, marks the beginning of growing old.",これが老いの始まりというやつなのだろう。,"Видимо, это уже старость даёт о себе знать.",
,,翠儿,,,,,,,,默认332,,翠儿/番外_翠儿_006,,[这些年来，良爷是怎么过得？],[這些年來，良爺是怎麼過得？],"""How has Master Liang fared these past years?""",「それで……この数年、良様はどうしてたの？」,"""Як Вы усе гэти годы поживали, господин Лян?""",
,,,,,,,,,,默认333,,,,翠儿眨着好奇的眼睛问道。,翠兒眨著好奇的眼睛問道。,Cui'er blinked with curiosity as she asked.,翠児が興味津々に目を輝かせながら訊いてきた。,"Спросила Цуйэр, мигая любопытными глазами.",
,,良,<Off>,,,,,,,默认334,,良/番外_良_43,,[那年送走你们后，我很快便去投了闯王，做了他的近侍护卫，随他在北方征战，直至洛阳。],[那年送走你們後，我很快便去投了闖王，做了他的近侍護衛，隨他在北方征戰，直至洛陽。],"""After seeing you off that year, I soon joined Dashing King Li, serving as his Close Guard. I followed him in his northern campaigns, all the way to Luoyang.""",「おまえ達を送り出してから、すぐに闖王の下についた。近衛として北の戦について行き、洛陽まで赴いた」,"""После того, как я тогда простился с вами, я вскоре примкнул к Королю 'Идущему Напролом', стал его личным телохранителем и сопровождал в его северных сражениях, пока мы не дошли до Лояна.""",
,,,,,,,,,,默认335,,,,我缓缓说道。,我緩緩說道。,I said deliberately.,ゆっくりとそう話した。,Не спеша поведал я.,
,,翠儿,,,,,,,,默认336,,翠儿/番外_翠儿_007,,[哇！闯王，是那个北方的头号反贼吗？],[哇！闖王，是那個北方的頭號反賊嗎？],"""Wow! Dashing King Li—that infamous rebel leader of the north?""",「わあ！闖王って、あの北でいちばん有名な反逆者の？」,"""Ого! Король 'Идущий Напролом' - гэта ж тот самый главный мятежник на Севере?""",
,BgEvent,相会聚餐2,,,,,1,,,,,,,
,,红儿,,,,,,,,默认337,,红儿/番外_红儿_04,,[嘘——翠儿你小声点……良爷，这么直接跟我们说……不太好吧？],[噓——翠兒你小聲點……良爺，這麼直接跟我們說……不太好吧？],"""Hush— Cui'er, lower your voice... Master Liang, speaking so plainly before us... is this wise?""",「しーっ――声を落として……良様、私たちに話すのは……その……よくないんじゃ？」,"""Тс-с-с! Цуй'эр, потише ты... Господин Лян, шо ж вы так напрямую нам про гэта рассказываете... Гэта ж не к добру, наверно?""",
,,,,,,,,,,默认338,,,,翠儿拔高了声音，而红儿反而压低了声音询问。,翠兒拔高了聲音，而紅兒反而壓低了聲音詢問。,"Cui'er's voice rose sharply, while Hong'er hushed hers to a whisper.",翠児の声が上ずったが、対する紅児は逆に声を落としてそう訊いた。,"Цуй'эр повысила голос, Хун'эр же, наоборот, понизила его, задавая свой вопрос.",
,,良,<Off>,,,,,,,默认339,,良/番外_良_44,,[无妨，这里没有外人，我相信你们。],[無妨，這裡沒有外人，我相信你們。],"""No matter. Here, we are among trusted kin.""",「構わんさ。他に誰もいないし、おまえ達のことを信じてるからな」,"""Ничего страшного - здесь нет посторонних, а Вам я доверяю.""",
,,,,,,,,,,默认340,,,,我笑了一声，表示并不在意。,我笑了一聲，表示並不在意。,"I gave a quiet laugh, brushing it aside.",俺は笑いながら、気にしていないと伝えた。,"Усмехнулся я, давая понять, что всё в порядке.",
,,,,,,,,,,默认341,,,,先不说我本就很相信红儿和翠儿，相信她们能替我保密。,先不說我本就很相信紅兒和翠兒，相信她們能替我保密。,Leaving aside my absolute faith in Hong'er and Cui'er to guard my secrets...,元々紅児と翠児のことは信用している。この二人なら俺の秘密を守ってくれるはずだ。,"Понятное дело, что я доверяю Хун'эр и Цуй'эр и верю, что они сохранят всё в тайне.",
,,,,,,,,,,默认342,,,,即便本地官府听到消息，大概也不会拿我怎么样。,即便本地官府聽到消息，大概也不會拿我怎麼樣。,"Even if the local magistrates learned of this, they'd hardly dare act against me.",地元の役人に知らせがいったとしても、俺にどうこうはできないだろう。,"Более того, даже если бы местные власти прознали про меня - вряд ли бы они стали что-то предпринимать.",
,,,,,,,,,,默认343,,,,他们恐怕难以相信，闯军势如破竹之际，竟会有人选择离开，只身南下来到此地。况且，我不过一介护卫近侍，非是刘将军、田将军那般的统兵大将，也不是牛军师那般的出谋划策之人，想来不至被过分关注。,他們恐怕難以相信，闖軍勢如破竹之際，竟會有人選擇離開，隻身南下來到此地。況且，我不過一介護衛近侍，非是劉將軍、田將軍那般的統兵大將，也不是牛軍師那般的出謀劃策之人，想來不至被過分關注。,"They'd find it inconceivable that one would abandon the Dashing Army's relentless march to venture south alone. Besides, I am but a lowly guard attendant—no field commander like Generals Liu or Tian, nor a strategist like Advisor Niu. I doubt I warrant much notice.",連中はきっと信じられないだろうな。闖軍が破竹の勢いで進軍している最中、そこから一人抜け出し、単身で南下してこんな場所にいるとは。まして俺は一介の護衛で、<ruby=りゅう>劉</ruby>将軍や<ruby=田>でん</ruby>将軍のような兵を統べる大将でもなければ、<ruby=ぎゅう>牛</ruby>軍師のような策謀を練る者でもない。そこまで注目されることはないはずだ。,"<size=25>Прежде всего, они в принципе вряд ли бы поверили, что в то время, пока Войска ""Идущие Напролом"" продвигаются на Севере своей всесокрушающей мощью, кто-то из их числа вдруг решил уйти и в одиночку отправился сюда на Юг. Ну а к тому же, я всего лишь простой телохранитель, не какой-то важный полководец вроде генерала Лю или генерала Тяня, и не стратег вроде военного советника Ню – и вряд ли заслуживаю особого внимания с их стороны.</size>",
,,,,,,,,,,默认344,,,,……,……,...,……,...,
,BgEvent,相会聚餐3,,,,,1,,,,,,,
,,满穗,,,,,,,,默认345,,满穗/番外_满穗_032,,[对了，为何鸢姐姐没跟你们在一起？],[對了，為何鳶姐姐沒跟你們在一起？],"""Speaking of which, why isn't Sister Kite traveling with you?""",「あっ……そうだ。<ruby=えん>鳶</ruby>姉さんは一緒じゃないの？」,"""Кстати, а почему сестричка Юань не с вами?""",
,,,,,,,,,,默认346,,,,正当我思考之时，满穗突然对红儿提问。,正當我思考之時，滿穗突然對紅兒提問。,"As I was lost in thought, Man Sui abruptly questioned Hong'er.",考え込んでいると、穂がふいに紅児にそんなことを訊いた。,"Пока я размышлял, вдруг Маньсуй обратилась с вопросом к Хун'эр.",
,,,,,,,,,,默认347,,,,嗯……,嗯……,Hmm...,うむ……,Ага...,
,,,,,,,,,,默认348,,,,这也是我挺好奇的事。,這也是我挺好奇的事。,That's something I've wondered about too.,それは俺も気になっていたことだ。,Это мне самому было интересно узнать.,
,,红儿,,,,,,,,默认349,,红儿/番外_红儿_05,,[鸢姐姐她……在扬州住了约莫半年，便返回故乡了。],[鳶姐姐她……在揚州住了約莫半年，便返回故鄉了。],"""After staying half a year in Yangzhou, Sister Kite... returned to her ancestral home.""",「鳶姉さんは……揚州に半年ほど住んでから、故郷に帰った」,"""Сястричка Юань... прожила у Янчжоу хде-то полгода, а потым вернулася у свои родные края.""",
,,翠儿,,,,,,,,默认350,,翠儿/番外_翠儿_008,,[是啊，她提到自己年纪大了，打算落叶归根，在老家找个僻静地方隐居。],[是啊，她提到自己年紀大了，打算落葉歸根，在老家找個僻靜地方隱居。],"""Aye. She said age weighed on her—wished to 'fall like leaves to roots,' retreating to some quiet corner of her birthplace.""",「うん、もう年だから里帰りして、在所の静かなところで隠居するって」,"""Ага. Она говорила, шо уже немолода и хочет вернуцца к своим истокам, отыскаць у родном краю укромный уголок и поселицца тама.""",
,,,,,,,,,,默认351,,,,红儿与翠儿你一言我一语，向我们告知了鸢的去向。,紅兒與翠兒你一言我一語，向我們告知了鳶的去向。,"Through Hong'er and Cui'er's animated exchange, we pieced together Kite's trail.",紅児と翠児が口々に話、鳶の居所を教えてくれた。,"Хун'эр и Цуй'эр наперебой рассказывали нам о том, куда отправилась Юань.",
,,良,<Off>,,,,,,,默认352,,良/番外_良_45,,[嗯……她故乡应当是在中原安阳附近吧？如今那里可不算太平……],[嗯……她故鄉應當是在中原安陽附近吧？如今那裡可不算太平……],"""Hmm... Her homeland must be near Anyang in the Central Plains, no? That land knows no peace these days...""",「そうか……たしか、あいつの故郷は中原の安陽のあたりだったな？今は平和とは言いがたいが……」,"""Хм... Её родной край вроде был где-то неподалёку от Аньяна на Центральной равнине? Но сейчас там не очень спокойно...""",
,,,,,,,,,,默认353,,,,我皱了皱眉。,我皺了皺眉。,I knitted my brows.,ふむむ、と眉間に皺を寄せた。,Нахмурился я.,
,,,,,,,,,,默认354,,,,此时中原战火纷飞，是闯军和官军交战的中心地带。,此時中原戰火紛飛，是闖軍和官軍交戰的中心地帶。,"The Central Plains now burned with war, the crucible where Dashing Army and government troops clashed.",今の中原は戦火の真っただ中だ。闖軍と官軍が戦っている主戦場だぞ。,"По всей Центральной равнине бушевал пожар сражений - это был центр столкновений между Войсками ""Идущими Напролом"" и правительственной армией.",
,,,,,,,,,,默认355,,,,虽然闯军的军纪与其他义军比起来算好的了，但那也只是对普通百姓而言。,雖然闖軍的軍紀與其他義軍比起來算好的了，但那也只是對普通百姓而言。,"Though the Dashing Army kept better discipline than other rebels, such order extended only to commoners.",いくら闖軍の軍規が他の義軍よりもましとはいえ、そいつは普通の庶民に対しての話だ。,"Пусть военная дисциплина в Войсках ""Идущих Напролом"" была получше, чем в других повстанческих армиях, - это касалось лишь отношения к простым жителям.",
,,,,,,,,,,默认356,,,,闯军对地主乡绅并不算友好，每到一个地方，常要“拷掠”当地富户，追索钱粮。,闖軍對地主鄉紳並不算友好，每到一個地方，常要“拷掠”當地富戶，追索錢糧。,"The Dashing Army dealt harshly with local gentry—wherever they marched, they ""persuaded"" wealthy households with fire and lash to yield grain and coin.",地主や豪族に対して友好的とは言えない。各地に赴くたび、闖軍は当地の金持ちを「拷問」し、金や食料を徴収していた。,"К помещикам и местной знати они относились отнюдь не дружелюбно - приходя в какую-либо местность, они часто ""подвергали допросу"" местных богачей, требуя от них денег и продовольствия.",
,,,,,,,,,,默认357,,,,闯王会让一些本地百姓评判富户的德行，对本地口碑极差的富户会严厉惩罚，甚至会当众处决。,闖王會讓一些本地百姓評判富戶的德行，對本地口碑極差的富戶會嚴厲懲罰，甚至會當眾處決。,Dashing King Li would have local villagers judge the virtue of wealthy households. Those with the worst reputations faced harsh punishment—sometimes even public execution.,闖王は現地の庶民に金持ちの品行を評価させ、評判の極めて悪い金持ちには厳しい懲罰を与え、時には処刑することもあった。,"Король ""Идущий Напролом"" обычно обращался к местным жителям, чтобы те дали ему своё суждение о местных богачах, - и те, у кого репутация была совсем плоха, подвергались суровым наказаниям, вплоть до публичной казни.",
,,,,,,,,,,默认358,,,,这本是一件看起来公正的好事，但也有一些闯军士兵会借此发挥，对富户家中无辜妇孺行不轨之事。,這本是一件看起來公正的好事，但也有一些闖軍士兵會藉此發揮，對富戶家中無辜婦孺行不軌之事。,"On the surface, this seemed a just and noble practice. Yet some Dashing Army soldiers twisted it into an excuse to prey upon the innocent women and children of these houses.",一見すれば公正な善行のように見えるが、闖軍の兵の中にはそれを建前に、金持ちの家に住んでいる無辜の女子供によからぬことをする者もいた。,"На первый взгляд это казалось справедливым и благородным делом - но некоторые из его войска злоупотребляли этим, подвергая издевательствам ни в чём не повинных женщин и детей из богатых домов.",
,,,,,,,,,,默认359,,,,当年，我曾为此与一些军纪差的兵将有过争吵，最激烈的一次，我甚至与一个叫郝摇旗的莽汉打过一架，各自在对方身上留下了一道伤疤。,當年，我曾為此與一些軍紀差的兵將有過爭吵，最激烈的一次，我甚至與一個叫郝搖旗的莽漢打過一架，各自在對方身上留下了一道傷疤。,"Back then, I often quarreled with undisciplined soldiers over such deeds. The fiercest clash was with a brute named Hao Yaoqi—we fought savagely, each carving a scar into the other.",当時、その件で規律を守らない兵たちと口論になったことがある。最もひどかったのは、<ruby=かくようえん>郝揺旗</ruby>という荒くれ者と殴り合いの喧嘩になり、互いの体に傷痕を残した時だ。,"В своё время я не раз ссорился из-за этого с такими не отличавшимися порядочностью солдатами и офицерами. Один раз даже дошло до того, что я вступил в схватку с грубияном по имени Хао Яоци, и мы оставили друг другу по шраму.",
,,,,,,,,,,默认360,,,,鸢出身安阳附近富户，这些年来也积累了不少财产，不知若是遇上闯军，会不会遭逢不测……,鳶出身安陽附近富戶，這些年來也積累了不少財產，不知若是遇上闖軍，會不會遭逢不測……,Kite hails from a prosperous family near Anyang and has amassed considerable wealth over the years. I fear she may come to harm should she cross paths with the Dashing Army...,鳶は安陽あたりの金持ちの家の出だ。ここ数年でも相当の財産をため込んでることだろう。もしも闖軍と出会ってしまったら、まずいことになるかもな……,"Юань была родом из богатой семьи с окрестностей Аньяна, да и за эти годы накопила немалое состояние. Не постигло бы её несчастье, попадись она на глаза Войскам ""Идущим Напролом""...",
,Sprite,黑,,特效前,,,0.5,,,,,,,,,,,
,Tween,黑,ColorTo,alpha=0 time=0,,,,,,,,,,,,,,
,Tween,黑,ColorTo,alpha=0.4 time=0,,,,,NoWait,,,,,,,,,
,Wait,,,,,,0,,,,,,,,,,,
,,,,,,,,,,默认361,,,,……,……,...,……,...,
,,,,,,,,,,默认362,,,,我相信闯王的品格。,我相信闖王的品格。,I trust in Dashing King Li's integrity.,闖王の品格は信用している。,"Моральным качествам Короля ""Идущего Напролом"" я доверяю.",
,,,,,,,,,,默认363,,,,却不相信整个闯军的品格。,卻不相信整個闖軍的品格。,Yet I distrust the integrity of the Dashing Army as a whole.,だが闖軍すべての品格までは信じられない。,Но вот моральным качествам его войска - нет.,
,,,,,,,,,,默认364,,,,……,……,...,……,...,
,SpriteOff,黑,,,,,0.5,,NoWait,,,,,,,,,
,Wait,,,,,,0.5,,,,,,,,,,,
,BgEvent,相会聚餐3,,,,,1,,,,,,,
,,翠儿,,,,,,,,默认365,,翠儿/番外_翠儿_009,,[鸢姐姐不会出事吧？我们最近给她寄的一封信，至今都没有回音……],[鳶姐姐不會出事吧？我們最近給她寄的一封信，至今都沒有回音……],"""Could Sister Kite be in trouble? The letter we sent her recently still remains unanswered...""",「鳶姉さんなら大丈夫だよね？最近手紙を送ったけど、まだ返信が来ないの……」,"""З сястричкой Юань же ничаго не случицца? Мы не так давно отправили ей письмо, но ответа усё так и не было...""",
,,,,,,,,,,默认366,,,,翠儿微微低着头，有些担忧。,翠兒微微低著頭，有些擔憂。,"Cui'er bowed her head slightly, her voice laced with concern.",翠児が心配そうにうなだれた。,Цуй'эр в беспокойстве опустила голову.,
,,满穗,,,,,,,,默认367,,满穗/番外_满穗_033,,[你们是如何与她联系的？],[你們是如何與她聯繫的？],"""How did you correspond with her?""",「どうやって連絡を取ってたの？」,"""А как вы с ней связываетесь?""",
,,,,,,,,,,默认368,,,,满穗冷静询问。,滿穗冷靜詢問。,Man Sui asked coolly.,満穂が冷静に尋ねる。,Спокойно спросила Маньсуй.,
,,翠儿,,,,,,,,默认369,,翠儿/番外_翠儿_010,,[鸢姐姐说，若是想与她联系，便要把信寄到安阳的驿站……三个月前我们寄了信，至今她都没回信。],[鳶姐姐說，若是想與她聯繫，便要把信寄到安陽的驛站……三個月前我們寄了信，至今她都沒回信。],"""Sister Kite instructed us to send letters to Anyang's courier station if we wished to contact her... We dispatched one three months ago, yet no reply has come.""",「連絡を取りたかったら安陽の駅に手紙をよこせって鳶姉さんが言ってたの……三か月前に送ったんだけど、まだ返事が来ない」,"""Сястричка Юань говорила, шо коли мы хотим з ней связацца, трэба отправляць письма на почтовую станцию у Аньяне... Три месяца тому мы отправили письмо, але она до сих пор так и не ответила.""",
,,满穗,,,,,,,,默认370,,满穗/番外_满穗_034,,[嗯……三个月不算太久，她若真是隐居了，一年半载难通音讯也是常事，不妨再耐心等等。],[嗯……三個月不算太久，她若真是隱居了，一年半載難通音訊也是常事，不妨再耐心等等。],"""Hmm... three months aren't too long. If she’s truly gone into seclusion, losing contact for a year or more is hardly unusual. Best to wait patiently a while longer.""",「そう……三か月なら遅いとも言えないわね。本当に隠居したなら、一年ろくに連絡が取れなくても当たり前だし、もう少し待ってみたら？」,"""Хм... Ну три месяца - это не так уж и долго. Если она действительно поселилась в отдалённом месте, то полгода-год без вестей - дело обычное. Подождите ещё немного, не торопитесь.""",
,,红儿,,,,,,,,默认371,,,,[……],[……],"""...""",「……」,"""...""",
,,翠儿,,,,,,,,默认372,,,,[……],[……],"""...""",「……」,"""...""",
,BgEvent,相会聚餐4,,,,,1,,,,,,,
,,满穗,,,,,,,,默认373,,满穗/番外_满穗_035,,[放心，中原地域广阔，可供躲避兵祸的偏僻之处甚多……这些年来，我便辗转躲过不少地方，从未与兵匪遭遇。],[放心，中原地域廣闊，可供躲避兵禍的偏僻之處甚多……這些年來，我便輾轉躲過不少地方，從未與兵匪遭遇。],"""Rest assured, the Central Plains are vast—there are countless remote corners to evade the ravages of war... Over the years, I’ve drifted from refuge to refuge, yet never once crossed paths with marauders or bandits.""",「安心して、中原は広いわ。隠れる場所なんていっぱいあるから……私たちも数年転々と隠れ住んでいたけれど、兵とばったり出くわすことなんてなかったから」,"""Не беспокойтесь, Центральная равнина обширна, там много неприметных мест, где можно укрыться от военных бедствий... За эти годы я переезжала там из одного места в другое, и мне удалось ни разу не столкнуться с солдатами или разбойниками.""",
,,,,,,,,,,默认374,,,,满穗用自己的经历劝慰，红儿和翠儿听到这里，脸上担忧的神色也终于少了几分。,滿穗用自己的經歷勸慰，紅兒和翠兒聽到這裡，臉上擔憂的神色也終於少了幾分。,"Man Sui reassured them with her own experiences, and at this, Hong'er and Cui’er finally shed some of the worry from their faces.",満穂は自分の経験で紅児と翠児を安心させた。二人はそれを聞いて、心配でいっぱいだった顔がようやくいくらかましになった。,"Успокоила их Маньсуй рассказом о своём собственном опыте. Услышав это, Хун'эр и Цуй'эр наконец-то поубавили своё беспокойство.",
