#SHEET_NAME,番外
,,,,,,,,,,默认552,,,,扬州毗邻运河，这里的夜晚从来都不寂静，盐商的园林庭院修得精致，青楼花街更显奢靡。,揚州毗鄰運河，這裡的夜晚從來都不寂靜，鹽商的園林庭院修得精緻，青樓花街更顯奢靡。,"Yangzhou, nestled along the canal, never quiets at night—its salt merchants' gardens are meticulously designed, while the Pleasure Houses and Flower Street brim with opulence.",揚州は運河に隣接し、夜通し賑やかな場所だ。塩商の屋敷の庭は上品に作られ、青楼や花街は豪勢の極みだ。,"Янчжоу был расположен рядом с Великим каналом, ночи там никогда не бывали тихими; сады и поместья торговцев солью отличались изысканной отделкой, а ""зелёные терема"" и ""цветочные улицы"" выглядели ещё более роскошно.",
,,,,,,,,,,默认553,,,,杭州靠近海湾，常能看到形形色色的商人，兜售各种异域奇珍，偶尔甚至能见到碧眼虬髯的番邦之人。,杭州靠近海灣，常能看到各種形形色色的商人，兜售各種異域奇珍，偶爾甚至能見到碧眼虬髯的番邦之人。,"Hangzhou, near the bay, bustles with merchants hawking exotic wares; now and then, even blue-eyed, bearded foreigners appear.",杭州は海に面し、様々な商人があちこちの珍品を売り歩く姿を見ることができる。時々、青い目で髭を生やした異国の者も見かけた。,"Ханчжоу же был расположен у морской бухты, здесь часто можно было увидеть торговцев самого разного вида, развозящих всевозможные экзотические диковинки - а иногда можно было даже встретить голубоглазых и большебородых чужеземцев.",
,,,,,,,,,,默认554,,,,扬州的城墙比杭州修得更高，也看着更坚固。,揚州的城牆比杭州修得更高，也看起來更堅固。,"Yangzhou's city walls were built taller than Hangzhou's, and seem far sturdier.",揚州の城壁は杭州よりも高く、より強固だ。,"Городские стены Янчжоу были выше, чем в Ханчжоу, и выглядели более крепкими.",
,,,,,,,,,,默认555,,,,但不知为何，我总觉得杭州这地方更让人安心。,但不知為何，我總覺得杭州這地方更讓人安心。,"Yet somehow, I've always found Hangzhou more comforting.",だがなぜだか、杭州の方がどことなく安心できた。,"Однако по какой-то причине мне казалось, что в Ханчжоу чувствуешь себя спокойнее.",
,,,,,,,,,,默认556,,,,这也让我觉得，满穗迁居于此的决断，必定是正确的。,這也讓我覺得，滿穗遷居於此的決斷，必定是正確的。,This convinces me that Man Sui's choice to settle here was undoubtedly wise.,それがまた、満穂がここに越そうとしたのが正解だったのだと思わせるに至った。,"И это наталкивало меня на мысль, что решение Маньсуй перебраться сюда определённо было верным.",
,,,,,,,,,,默认557,,,,就这样，光阴如水，静静流淌。,就這樣，光陰如水，靜靜流淌。,Thus did time flow like quiet waters.,そんなこんなで、月日が水のように静かに流れていった。,"И так время тихо текло, словно вода.",
,,,,,,,,,,默认558,,,,一年、两年、三年，倏然而逝。,一年、兩年、三年，倏然而逝。,"One year, two years, three—gone in the blink of an eye.",一年、二年、三年……あっという間だった。,"Один год, два, три - пролетели в мгновение ока.",
,,,,,,,,,,默认559,,,,这些年来，我始终伴于满穗身侧。,這些年來，我始終伴於滿穗身側。,"Through all these years, I've remained steadfast at Man Sui's side.",その間、俺は常に満穂の傍にいた。,Все эти годы я ни на шаг не отлучался от Маньсуй.,
,,,,,,,,,,默认560,,,,郑家的海上生意比她之前的河上生意要赚得更多。,鄭家的海上生意比她之前的河上生意要賺的更多。,The Zheng Family's maritime ventures yielded far greater profits than her former river trade.,鄭家との海の商売は、川でやっていた仕事よりも儲かった。,"Морская торговля вместе с семьёй Чжэн была прибыльнее, чем торговля на реке.",
,,,,,,,,,,默认561,,,,但是也不好做。,但是也不好做。,Yet the path was far from smooth.,しかし、やりづらさもあった。,Но вести её было нелегко.,
,,,,,,,,,,默认562,,,,郑家不仅是南方最大的海商家族，也是最大的海寇家族。,鄭家不僅是南方最大的海商家族，也是最大的海寇家族。,"The Zheng Family stood not only as the south's greatest maritime merchants, but also its most formidable sea rovers.",鄭家は南で最大の海商の一族であると同時に、最大の海賊の一族でもあったからだ。,Семья Чжэн на Юге была не только крупнейшим родом морских торговцев - но и крупнейшим родом морских разбойников.,
,,,,,,,,,,默认563,,,,他们中有很讲理的商人，也有很野蛮的海贼。,他們中有很講理的商人，也有很野蠻的海賊。,"Among them were reasonable merchants, but also savage pirates.",話が通じる商人もいれば、野蛮な海賊もいる。,"Среди них встречались как весьма благоразумные торговцы, так и совершенно дикие пираты.",
,,,,,,,,,,默认564,,,,有些海贼常年在海上讨生活，目无法纪，动辄便会心生歹念。,有些海賊常年在海上討生活，目無法紀，動輒便會心生歹念。,"Some pirates spent years living off the sea, lawless and prone to wicked impulses.",一年を通してほぼ海で生計を立てている海賊もいる。そういう連中に法は通じないし、くだらないことを考える。,"Некоторые пираты, годами зарабатывавшие на морском промысле, не признавали никаких законов и при малейшем удобном случае замышляли недоброе.",
,,,,,,,,,,默认565,,,,甚至，有些品德极差之徒，会在交易时突然翻脸想要扣下货物，或是在交易后趁夜偷袭，想要把给我们的银两抢回去。,甚至，有些品德極差之徒，會在交易時突然翻臉想要扣下貨物，或是在交易後趁夜偷襲，想要把給我們的銀兩搶回去。,"Worse still, some particularly unscrupulous ones would suddenly turn hostile during trade, attempting to seize goods, or launch night raids after transactions to reclaim the silver taels they'd given us.",特に品性のない連中は、取引の最中に突然態度を変えて荷物だけ抑えようとしたり、取引の後の夜闇に乗じて襲い、俺たちに払った金を奪い返そうとするのだ。,"Наиболее безнравственные из них даже могли во время торговли внезапно проявить враждебность и попытаться отобрать товар, либо же по завершении сделки, воспользовавшись ночной тьмой, устроить нападение, чтобы отобрать у нас обратно серебро.",
,,,,,,,,,,默认566,,,,这时候，我便会帮到满穗，起到我的作用。,這時候，我便會幫到滿穗，起到我的作用。,"At such times, I would assist Man Sui and fulfill my role.",そういう時は穂の手伝いに出て、俺の為すべきことを為す。,В такие моменты приходила пора мне выполнять свою роль.,
,,,,,,,,,,默认567,,,,我挑选训练了十余名年轻力壮者，组成持刀护卫队，率领他们一同守护满穗与商队安危。,我挑選訓練了十餘名年輕力壯者，組成持刀護衛隊，率領他們一同守護滿穗與商隊安危。,"I selected and trained over a dozen strong young men to form an armed escort team, leading them to protect Man Sui and the merchant convoy.",十数人の若くて腕っぷしのいいのを選んで訓練し、剣を担いだ護衛隊を結成し、そいつらを率いて穂と商隊の安全を守り抜く。,"Я отобрал и натренировал больше десятка крепких молодчиков, из которых соорудил охранный отряд - под моим началом они охраняли безопасность Маньсуй и торгового каравана.",
,,,,,,,,,,默认568,,,,曾经，我是闯王的近侍护卫。,曾經，我是闖王的近侍護衛。,I once served as Dashing King Li's Close Guard.,かつての俺は、闖王の横に仕える護衛だった。,"Некогда я служил телохранителем у Короля, Идущего Напролом.",
,,,,,,,,,,默认569,,,,如今，我是她的近侍护卫。,如今，我是她的近侍護衛。,Now I stand as her Close Guard.,今の俺は、彼女の横に仕える護衛だ。,Теперь же я служил телохранителем у неё.,
,,,,,,,,,,默认570,,,,……,……,...,……,...,
,BgEvent,良穗谈话,,,,,1,,,,,,,
,,,,,,,,,,默认571,,,,时间一点点推移，一日，我再度听闻了闯王的消息。,時間一點點推移，一日，我再度聽聞了闖王的消息。,Time flowed onward until the day news of Dashing King Li reached me once more.,時間が過ぎていき、ある日、闖王の話を耳にした。,"Время продолжало свой ход - и в один день до меня дошли вести о Короле, Идущем Напролом.",
,,满穗,,,,,,,,默认572,,满穗/番外_满穗_070,,[出大事了。],[出大事了。],"""A calamity has occurred.""",「大変なことになったわ」,"""Серьёзное дело приключилось.""",
,,,,,,,,,,默认573,,,,一日，正与满穗对坐饮茶，她忽接到手下呈上一封书信。,一日，正與滿穗對坐飲茶，她忽接到手下呈上一封書信。,"One afternoon as Man Sui and I shared tea, a subordinate abruptly delivered a letter.",ある日、満穂と向かい合って茶を飲んでいると、彼女が部下から一通の手紙を受け取った。,"В один день, когда мы с Маньсуй сидели друг напротив друга и пили чай, один из подчинённых вдруг передал ей письмо.",
,,,,,,,,,,默认574,,,,她看过书信后，便神色凝重地望向了我。,她看過書信後，便神色凝重地望向了我。,"Having read its contents, she fixed me with solemn eyes.",彼女が手紙を受け取り、深刻な表情で俺を見た。,"Прочитав его, она с напряжённым выражением лица посмотрела на меня.",
,,良,<Off>,,,,,,,默认575,,良/番外_良_69,,[出什么事了？],[出什麼事了？],"""What troubles you?""",「何があった？」,"""А что случилось?""",
,,满穗,,,,,,,,默认576,,满穗/番外_满穗_071,,[闯王已攻破京师，崇祯皇帝在煤山……自缢了。],[闖王已攻破京師，崇禎皇帝在煤山……自縊了。],"""Dashing King Li has taken the capital... Emperor Chongzhen took his own life at Coal Hill.""",「闖王が都を落とし、崇禎皇帝は煤山で……自ら首を括り、果てた」,"""Король, Идущий Напролом, взял столицу, а император Чунчжэнь на горе Мэйшань... покончил с собой.""",
,,良,<Off>,,,,,,,默认577,,,,[……],[……],"""...""",「……」,"""...""",
,,良,<Off>,,,,,,,默认578,,良/番外_良_70,,[这下改朝换代了，大哥的永昌天子并非自称，他很快便会成为新朝的皇帝了……],[這下改朝換代了，大哥的永昌天子並非自稱，他很快便會成為新朝的皇帝了……],"""The Mandate of Heaven shifts... Big Brother's claim as 'Eternal Prosperity Emperor' will soon be reality when he ascends the throne.""",「これで王朝が変わって、兄貴の永昌帝も自称じゃなくなるな。間もなく新王朝の皇帝だ……」,"""Получается, династия сменилась, и теперь императорское имя 'Юнчан', которое придумал себе старшой, уже не будет простым бахвальством - он скоро станет настоящим императором новой династии...""",
,,,,,,,,,,默认579,,,,我先是震惊一愣，然后很快便内心雀跃起来。,我先是震驚一愣，然後很快便內心雀躍起來。,"At first, I stood stunned, but soon my heart leaped with joy.",俺は驚いたが、すぐに内心で小躍りした。,"Сначала я ошеломлённо замер, но вскоре моё сердце забилось от радости.",
,,,,,,,,,,默认580,,,,改朝换代后的新皇帝，是我曾经护卫过的大哥，这怎能不让人心绪激荡？,改朝換代後的新皇帝，是我曾經護衛過的大哥，這怎能不讓人心緒激盪？,The new emperor after the dynasty's fall was the big brother I once protected—how could this not set one's heart ablaze?,王朝が交代するとなれば、新たな皇帝は俺がかつて護衛していた兄貴分になる。これほど心が躍ることがあろうか。,"Новым императором после смены династии станет ""старшой"", телохранителем которого я некогда был - как такое может не вызывать восторг?",
,,满穗,,,,,,,,默认581,,满穗/番外_满穗_072,,[嗯……且看闯王能否坐稳这江山吧。依良爷往日所言，他确有帝王气度，然则御下过于宽纵，对待士绅乡宦又过于严苛……],[嗯……且看闖王能否坐穩這江山吧。依良爺往日所言，他確有帝王氣度，然則御下過於寬縱，對待士紳鄉宦又過於嚴苛……],"""Hmm... We shall see if Dashing King Li can hold the realm. As Master Liang once observed, he bears the dignity of an emperor, yet he is too indulgent with his underlings and overly severe toward the gentry and local magnates...""",「そうね……ひとまず闖王の天下が続くか見ものだわ。良様から聞いた話では、帝王の器はあれど、部下に甘すぎるのと、地方官僚への締め付けが厳しすぎるとのことだったから……」,"""Хм... Посмотрим, сможет ли Король, Идущий Напролом, удержать эту власть в своих руках. Судя по тому, что ты о нём рассказывал господин Лян, у него действительно есть задатки для императора, однако он слишком снисходителен к подчинённым и слишком суров к местной знати и чиновникам...""",
,,,,,,,,,,默认582,,,,满穗微微皱眉，抿着唇分析道。,滿穗微微皺眉，抿著唇分析道。,"Man Sui frowned slightly, her lips pressed tight as she analyzed.",穂が顔をしかめ、唇を噛んでそう分析する。,"Слегка нахмурившись и сжав губы, высказала своё суждение Маньсуй.",
,,,,,,,,,,默认583,,,,从她的神色可以看出——她对闯王的前景不太看好，甚至是有些担忧。,從她的神色可以看出——她對闖王的前景不太看好，甚至是有些擔憂。,"Her expression betrayed it—she held little faith in Dashing King Li's future, even a tinge of worry.",彼女の表情でわかる――闖王の天下をあまり楽観的に受け取っていない。むしろ少し不安に思っている。,"Судя по её выражению лица - она не слишком доверяла перспективам Короля, Идущего Напролом, можно даже сказать, испытывала по этому поводу определённую тревогу.",
,,满穗,,,,,,,,默认584,,满穗/番外_满穗_073,,[呵，良爷若是当初继续跟着闯王，如今怕是已经封侯拜将，此刻……你会不会后悔？],[呵，良爺若是當初繼續跟著闖王，如今怕是已經封侯拜將，此刻……你會不會後悔？],"""Heh, had Master Liang stayed with Dashing King Li back then, he might have been granted a noble title by now... Do you ever regret it?""",「ふふ、あのまま闖王についていれば、良様は今頃将軍に任じられていたでしょう？……後悔してない？」,"""Хех, а если бы ты тогда продолжал следовать за ним дальше, господин Лян, сегодня тебе могли бы уже пожаловать титул и генеральское звание... Не жалеешь?""",
,,,,,,,,,,默认585,,,,短暂地担忧过后，她话锋一转，含笑问我。,短暫地擔憂過後，她話鋒一轉，含笑問我。,"After a brief moment of concern, she shifted the topic and asked me with a smile.",しばしの躊躇の後、彼女が話題を変えて、笑いながらそう訊いた。,После кратковременного беспокойства она сменила тему и с улыбкой спросила меня.,
,,良,<Off>,,,,,,,默认586,,良/番外_良_71,,[还好，不算很后悔，封侯获地本就不是我的追求。],[還好，不算很後悔，封侯獲地本就不是我的追求。],"""Not really. I don’t regret it much. Titles and lands were never my pursuit.""",「別に後悔するほどのことでもないさ。将になって領地を得るのが俺の夢ってわけでもないしな」,"""Да нет, особо не жалею - не то чтобы я вообще стремился к каким-то титулам и землям.""",
,,,,,,,,,,默认587,,,,我也轻笑着摇了摇头。,我也輕笑著搖了搖頭。,I shook my head with a light chuckle.,俺も微笑みながら首を振った。,"Усмехнувшись, я покачал головой.",
,,良,<Off>,,,,,,,默认588,,,,[……],[……],"""...""",「……」,"""...""",
,,,,,,,,,,默认589,,,,有一句话，我哽在喉间，没好意思对她说出口。,有一句話，我哽在喉間，沒好意思對她說出口。,"There was one thing I couldn’t bring myself to say to her, lodged in my throat.",あることを言おうとして喉まで言葉が出かかったが、言う勇気が出なかった。,"Было и ещё кое-что, что я так и не решился высказать вслух - слова застряли у меня в горле.",
,,,,,,,,,,默认590,,,,其实，当年若是留在闯军，因此与她错过……,其實，當年若是留在闖軍，因此與她錯過……,"Truth be told, had I stayed with the Dashing Army back then and missed meeting her...",あの時、もしも闖軍に残っていたせいで、彼女と行き違いになっていたら……,"Ведь на самом деле, если бы я тогда остался вместе с Королём, Идущим Напролом, и из-за этого разминулся бы с ней...",
,,,,,,,,,,默认591,,,,那我才会真的后悔。,那我才會真的後悔。,That would have been my true regret.,それこそ本当に後悔していた。,Вот тогда бы я действительно сильно жалел об этом.,
,,,,,,,,,,默认592,,,,……,……,...,……,...,
,,,,,,,,,,默认593,,,,我本以为，我比满穗要了解闯王。,我本以為，我比滿穗要了解闖王。,I once thought I understood Dashing King Li better than Man Sui did.,俺はてっきり、穂よりも闖王のことをよく理解していると思っていた。,"Я-то полагал, что уж в Короле, Идущем Напролом, я разбираюсь получше Маньсуй.",
,,,,,,,,,,默认594,,,,我认为她对闯王的担忧是多余的，闯王在攻破京师后，要不了多久便会一统天下。,我認為她對闖王的擔憂是多餘的，闖王在攻破京師後，要不了多久便會一統天下。,"I believe her concerns about Dashing King Li are unfounded. Once he takes the capital, he will swiftly unite the realm.",彼女の闖王への心配は杞憂だと思っていた。闖王が都を落とせば、そう遠くないうちに天下統一を成すだろうと。,"Считал её опасения по поводу перспектив его власти излишними - после взятия столичного города ему вряд ли понадобилось бы много времени, чтобы объединить под собой всю страну.",
,,,,,,,,,,默认595,,,,可一切突然间便有了极大的变数。,可一切突然便有了極大的變數。,"Yet suddenly, everything took a drastic turn.",しかし事がとんでもない方向に転がっていった。,Однако ситуация совершенно неожиданно резко переменилась.,
,,,,,,,,,,默认596,,,,不出两个月，北方又传来了新的消息。,不出兩個月，北方又傳來了新的消息。,"Within two months, fresh news arrived from the north.",二か月もせず、再び北から新たな情報が入った。,"Не прошло и двух месяцев, как с Севера пришли новые известия.",
,,,,,,,,,,默认597,,,,闯王入京后，写信招降总兵吴三桂，吴三桂不从，留在山海关。,闖王入京後，寫信招降總兵吳三桂，吳三桂不從，留在山海關。,"After entering the capital, Dashing King Li wrote to General Wu Sangui demanding his surrender, but Wu refused and held his position at Shanhai Pass.",闖王が都に入った後、降伏するよう総兵の<ruby=ごさんけい>呉三桂</ruby>に手紙を送ったが、呉三桂は従わず、山海関に居座ったのだ。,"Захватив столицу, Король, Идущий Напролом, направил послание командующему У Саньгую с призывом сдаться. Тот не подчинился и остался у Шаньхайгуаньской заставы.",
,,,,,,,,,,默认598,,,,于是，闯王召集兵马讨伐吴三桂，吴三桂引清兵入关，与关外的清军一同将闯王杀得大败。,於是，闖王召集兵馬討伐吳三桂，吳三桂引清兵入關，與關外的清軍一同將闖王殺得大敗。,"Thus, Dashing King Li rallied his forces to crush Wu Sangui, who retaliated by leading the Qing Army through the pass. Together with the Qing troops beyond the frontier, they dealt Dashing King Li a devastating defeat.",そのため闖王は兵を集めて呉三桂の討伐に乗り出したが、呉三桂は関内に清の兵を招き入れ、関外の清軍と共に闖王を返り討ちにした。,"Тогда Король, Идущий Напролом, собрал против него карательный отряд - но тот впустил через заставу войска маньчжурской Цин и вместе с ними нанёс Королю, Идущему Напролом, сокрушительное поражение.",
,,,,,,,,,,默认599,,,,天下纷扰，并未止息。,天下紛擾，並未止息。,"The realm remained in turmoil, its unrest unending.",天下の動乱は未だに収まる気配がない。,Беспорядки в Поднебесной всё никак не собирались утихать.,
,,,,,,,,,,默认600,,,,风雨欲来，人心惶惶。,風雨欲來，人心惶惶。,"Storm clouds gathered, and hearts trembled with dread.",嵐が迫り、人々は不安に駆られた。,"Сгущались тучи, народ был в тревоге.",
,,,,,,,,,,默认601,,,,……,……,...,……,...,
,FadeOut,black,,wipe_up,,,1,,,,,,,,,,,
,Bg,天空阴,,,,,0,,,,,,,,,,,
,FadeIn,black,,wipe_down,,,1,,,,,,,,,,,
,,,,,,,,,,默认602,,,,又过了几个月。,又過了幾個月。,Several more months passed.,それからまた数か月が過ぎた。,Прошло ещё несколько месяцев.,
,,,,,,,,,,默认603,,,,清军势如破竹，闯军节节败退。,清軍勢如破竹，闖軍節節敗退。,"The Qing Army advanced with unstoppable momentum, while the Dashing Army suffered repeated defeats.",清軍が破竹の勢いで進軍し、闖軍は度重なる敗北を喫した。,"Армия Цин продвигалась подобно лавине, а Войска, Идущие Напролом, терпели поражение за поражением.",
